ID,Categoria,Titulo,Medio,Fecha,Resumen,Comentario_Reaccion,Unnamed: 7,Titulo_len_char,Titulo_len_words,Resumen_len_char,Resumen_len_words,Comentario_Reaccion_len_char,Comentario_Reaccion_len_words,Titulo_clean,Titulo_tokens,Resumen_clean,Resumen_tokens,Comentario_Reaccion_clean,Comentario_Reaccion_tokens,texto_combinado,tema_dominante
78,Frankenstein,El impacto de la pelï¿½ï¿½cula en la moda gï¿½ï¿½tic,Fashionista,10/11/2025,Las tendencias de vestuario de la pelï¿½ï¿½cula inspiran nuevos lo,"Me copio el look de Victor, muy elegante y oscuro.",,52,9,66,10,50,10,el impacto de la pel cula en la moda g tic,"['impacto', 'pel', 'cula', 'moda', 'tic']",las tendencias de vestuario de la pel cula inspiran nuevos lo,"['tendencias', 'vestuario', 'pel', 'cula', 'inspiran', 'nuevos']",me copio el look de victor muy elegante y oscuro,"['copio', 'look', 'victor', 'elegante', 'oscuro']",las tendencias de vestuario de la pel cula inspiran nuevos lo me copio el look de victor muy elegante y oscuro,2
79,Generacion Z,Anï¿½ï¿½lisis de los cï¿½ï¿½nticos y consignas de l,Lingï¿½ï¿½ï¿½ï¿½stic,17/11/2025,El uso del sarcasmo y el humor negro en las protestas.,La mejor forma de protestar es con inteligencia y humor.,,51,8,54,11,56,10,an lisis de los c nticos y consignas de l,"['lisis', 'nticos', 'consignas']",el uso del sarcasmo y el humor negro en las protestas,"['uso', 'sarcasmo', 'humor', 'negro', 'protestas']",la mejor forma de protestar es con inteligencia y humor,"['mejor', 'forma', 'protestar', 'inteligencia', 'humor']",el uso del sarcasmo y el humor negro en las protestas la mejor forma de protestar es con inteligencia y humor,1
80,Frankenstein,Frankenstein en el Top 10 de IMDb,IMDb Charts,15/11/2025,La pelï¿½ï¿½cula mantiene una alta calificaciï¿½ï¿½n entre los u,Una joya que serï¿½ï¿½ un clï¿½ï¿½sico insta,,33,7,64,9,44,7,frankenstein en el top 10 de imdb,"['frankenstein', 'top', 'imdb']",la pel cula mantiene una alta calificaci n entre los u,"['pel', 'cula', 'mantiene', 'alta', 'calificaci']",una joya que ser un cl sico insta,"['joya', 'ser', 'sico', 'insta']",la pel cula mantiene una alta calificaci n entre los u una joya que ser un cl sico insta,3
81,Generacion Z,Usuarios de Reddit discuten la efectividad de las marchas,Reddit r/Mexico,18/11/2025,Debate sobre si el cambio se logra en la calle o en las urnas.,"Ambos. La calle presiona, la urna decide.",,57,9,62,14,41,7,usuarios de reddit discuten la efectividad de las marchas,"['usuarios', 'reddit', 'discuten', 'efectividad', 'marchas']",debate sobre si el cambio se logra en la calle o en las urnas,"['debate', 'cambio', 'logra', 'calle', 'urnas']",ambos la calle presiona la urna decide,"['ambos', 'calle', 'presiona', 'urna', 'decide']",debate sobre si el cambio se logra en la calle o en las urnas ambos la calle presiona la urna decide,1
82,Frankenstein,La crï¿½ï¿½tica elogia la cinematografï¿½ï¿½a en blanco y negro (Versiï¿½ï¿,Sundance Review,12/11/2025,Se lanzï¿½ï¿½ una ediciï¿½ï¿½n limitada en blanco y negro par,El B&N le da un aire mï¿½ï¿½s clï¿½ï¿½sico y dra,,75,10,61,10,48,10,la cr tica elogia la cinematograf a en blanco y negro versi,"['tica', 'elogia', 'cinematograf', 'blanco', 'negro', 'versi']",se lanz una edici n limitada en blanco y negro par,"['lanz', 'edici', 'limitada', 'blanco', 'negro', 'par']",el b n le da un aire m s cl sico y dra,"['aire', 'sico', 'dra']",se lanz una edici n limitada en blanco y negro par el b n le da un aire m s cl sico y dra,2
83,Generacion Z,Cobertura en vivo de la marcha es la mï¿½ï¿½s vista en Face,Facebook Live,16/11/2025,Miles de personas siguieron la transmisiï¿½ï¿½n en tiempo r,"Vi todo desde casa, me sentï¿½ï¿½ parte de e",,59,12,59,9,44,9,cobertura en vivo de la marcha es la m s vista en face,"['cobertura', 'vivo', 'marcha', 'vista', 'face']",miles de personas siguieron la transmisi n en tiempo r,"['miles', 'personas', 'siguieron', 'transmisi', 'tiempo']",vi todo desde casa me sent parte de e,"['casa', 'sent', 'parte']",miles de personas siguieron la transmisi n en tiempo r vi todo desde casa me sent parte de e,3
84,Frankenstein,"Del Toro: ""Mi Frankenstein no tiene miedo"," tiene dolor""",MasterClass,09/11/2025,El director explica la emociï¿½ï¿½n dominante de la criat,"Una frase que lo resume todo, puro dolor.",41,7,10,1,57,9,del toro mi frankenstein no tiene miedo,"['toro', 'frankenstein', 'miedo']",09 11 2025,['2025'],el director explica la emoci n dominante de la criat,"['director', 'explica', 'emoci', 'dominante', 'criat']",09 11 2025 el director explica la emoci n dominante de la criat,1
85,Generacion Z,La Generaciï¿½ï¿½n Z y su relaciï¿½ï¿½n con el pasado p,Revista Nexos,17/11/2025,Los jï¿½ï¿½venes critican a generaciones anteriores por la inacci,"Heredamos un paï¿½ï¿½s roto, nos toca arregla",,55,10,65,9,45,7,la generaci n z y su relaci n con el pasado p,"['generaci', 'relaci', 'pasado']",los j venes critican a generaciones anteriores por la inacci,"['venes', 'critican', 'generaciones', 'anteriores', 'inacci']",heredamos un pa s roto nos toca arregla,"['heredamos', 'roto', 'toca', 'arregla']",los j venes critican a generaciones anteriores por la inacci heredamos un pa s roto nos toca arregla,1
86,Frankenstein,Actriz [Actriz 3] sobre el rol femenino en la historia,Women in Film,11/11/2025,El papel de las mujeres en la nueva adaptaciï¿½ï,Los personajes femeninos son mï¿½ï¿½s fuertes y comple,,54,10,48,9,54,8,actriz actriz 3 sobre el rol femenino en la historia,"['actriz', 'actriz', 'rol', 'femenino', 'historia']",el papel de las mujeres en la nueva adaptaci,"['papel', 'mujeres', 'nueva', 'adaptaci']",los personajes femeninos son m s fuertes y comple,"['personajes', 'femeninos', 'fuertes', 'comple']",el papel de las mujeres en la nueva adaptaci los personajes femeninos son m s fuertes y comple,2
87,Generacion Z,"Marcha es calificada como ""evento generacional""",Analistas Polï¿½ï¿½t,18/11/2025,Se compara el impacto cultural con el Vive Latino.,Un evento que marcarï¿½ï¿½ a esta generaci,,47,6,50,9,42,7,marcha es calificada como evento generacional,"['marcha', 'calificada', 'evento', 'generacional']",se compara el impacto cultural con el vive latino,"['compara', 'impacto', 'cultural', 'vive', 'latino']",un evento que marcar a esta generaci,"['evento', 'marcar', 'generaci']",se compara el impacto cultural con el vive latino un evento que marcar a esta generaci,0
88,Frankenstein,Frankenstein es la pelï¿½ï¿½cula mï¿½ï¿½s tuiteada de l,Twitter Trends,08/11/2025,Millones de menciones sobre el estreno.,"El hype es real, todos estï¿½ï¿½n hablando de e",,55,8,39,6,47,9,frankenstein es la pel cula m s tuiteada de l,"['frankenstein', 'pel', 'cula', 'tuiteada']",millones de menciones sobre el estreno,"['millones', 'menciones', 'estreno']",el hype es real todos est n hablando de e,"['hype', 'real', 'est', 'hablando']",millones de menciones sobre el estreno el hype es real todos est n hablando de e,2
89,Generacion Z,Grupos de apoyo legal asisten a detenidos,Pro Bono Mï¿½ï¿½,16/11/2025,Abogados ofrecen ayuda gratuita a los arrestados.,La solidaridad legal es clave en las protestas.,,41,7,49,7,47,8,grupos de apoyo legal asisten a detenidos,"['grupos', 'apoyo', 'legal', 'asisten', 'detenidos']",abogados ofrecen ayuda gratuita a los arrestados,"['abogados', 'ofrecen', 'ayuda', 'gratuita', 'arrestados']",la solidaridad legal es clave en las protestas,"['solidaridad', 'legal', 'clave', 'protestas']",abogados ofrecen ayuda gratuita a los arrestados la solidaridad legal es clave en las protestas,3
90,Frankenstein,Del Toro elogia la actuaciï¿½ï¿½n de [Actor 4] como Henry Cle,Entrevista Backstage,07/11/2025,El director destaca el soporte emocional del personaje.,Clerval es la ï¿½ï¿½nica luz en la oscuridad del Dr. Frankenst,,61,11,55,8,62,11,del toro elogia la actuaci n de actor 4 como henry cle,"['toro', 'elogia', 'actuaci', 'actor', 'henry', 'cle']",el director destaca el soporte emocional del personaje,"['director', 'destaca', 'soporte', 'emocional', 'personaje']",clerval es la nica luz en la oscuridad del dr frankenst,"['clerval', 'nica', 'luz', 'oscuridad', 'frankenst']",el director destaca el soporte emocional del personaje clerval es la nica luz en la oscuridad del dr frankenst,0
91,Generacion Z,El uso de cï¿½ï¿½digos y emojis en la convocat,Wired,15/11/2025,Anï¿½ï¿½lisis de cï¿½ï¿½mo se organizan secre,Usamos cï¿½ï¿½digos para evitar la cens,,46,9,45,6,39,6,el uso de c digos y emojis en la convocat,"['uso', 'digos', 'emojis', 'convocat']",an lisis de c mo se organizan secre,"['lisis', 'organizan', 'secre']",usamos c digos para evitar la cens,"['usamos', 'digos', 'evitar', 'cens']",an lisis de c mo se organizan secre usamos c digos para evitar la cens,3
92,Frankenstein,Los coleccionables de Frankenstein se agotan en lï¿½ï¿,Merchandise News,13/11/2025,Figuras y pï¿½ï¿½sters de ediciï¿½ï¿½n l,Quiero el Funko Pop del Monstruo inmediatamente.,,54,8,40,6,48,7,los coleccionables de frankenstein se agotan en l,"['coleccionables', 'frankenstein', 'agotan']",figuras y p sters de edici n l,"['figuras', 'sters', 'edici']",quiero el funko pop del monstruo inmediatamente,"['quiero', 'funko', 'pop', 'monstruo', 'inmediatamente']",figuras y p sters de edici n l quiero el funko pop del monstruo inmediatamente,2
93,Generacion Z,Medios internacionales critican la respuesta del gobierno,The New York Times,17/11/2025,La reacciï¿½ï¿½n oficial es vista como minimizaci,El mundo estï¿½ï¿½ viendo cï¿½ï¿½mo nos,,57,7,49,7,39,6,medios internacionales critican la respuesta del gobierno,"['medios', 'internacionales', 'critican', 'respuesta', 'gobierno']",la reacci n oficial es vista como minimizaci,"['reacci', 'oficial', 'vista', 'minimizaci']",el mundo est viendo c mo nos,"['mundo', 'est', 'viendo']",la reacci n oficial es vista como minimizaci el mundo est viendo c mo nos,0
94,Frankenstein,Frankenstein: Una clase magistral de diseï¿½ï¿½o de so,Audio Post,10/11/2025,El uso del silencio y los efectos de sonido gutural.,El sonido del latido del Monstruo es aterrador.,,54,8,52,10,47,8,frankenstein una clase magistral de dise o de so,"['frankenstein', 'clase', 'magistral', 'dise']",el uso del silencio y los efectos de sonido gutural,"['uso', 'silencio', 'efectos', 'sonido', 'gutural']",el sonido del latido del monstruo es aterrador,"['sonido', 'latido', 'monstruo', 'aterrador']",el uso del silencio y los efectos de sonido gutural el sonido del latido del monstruo es aterrador,2
95,Generacion Z,Testimonios de desalojo en la Alameda Central,Diario de Mï¿½ï¿½,16/11/2025,Cuentas de primera mano sobre la intervenciï¿½ï¿½n polic,Fue violento y desproporcionado.,,45,7,56,8,32,4,testimonios de desalojo en la alameda central,"['testimonios', 'desalojo', 'alameda', 'central']",cuentas de primera mano sobre la intervenci n polic,"['cuentas', 'primera', 'mano', 'intervenci', 'polic']",fue violento y desproporcionado,"['violento', 'desproporcionado']",cuentas de primera mano sobre la intervenci n polic fue violento y desproporcionado,2
96,Frankenstein,"Del Toro: ""Es una tragedia sobre la paternidad fallida""",Focus Features,05/11/2025,El director se enfoca en la responsabilidad del creador.,Es la peor historia de un papï¿½ï¿½ que abandona a su h,,55,9,56,9,55,12,del toro es una tragedia sobre la paternidad fallida,"['toro', 'tragedia', 'paternidad', 'fallida']",el director se enfoca en la responsabilidad del creador,"['director', 'enfoca', 'responsabilidad', 'creador']",es la peor historia de un pap que abandona a su h,"['peor', 'historia', 'pap', 'abandona']",el director se enfoca en la responsabilidad del creador es la peor historia de un pap que abandona a su h,0
97,Generacion Z,Las 'Fake News' sobre la marcha: Desmentidos de la Gen Z,VerificadorMx,15/11/2025,Jï¿½ï¿½venes usan sus redes para desmentir rumores oficia,Nos toca a nosotros ser los verificadores.,,56,11,57,8,42,7,las fake news sobre la marcha desmentidos de la gen z,"['fake', 'news', 'marcha', 'desmentidos', 'gen']",j venes usan sus redes para desmentir rumores oficia,"['venes', 'usan', 'redes', 'desmentir', 'rumores', 'oficia']",nos toca a nosotros ser los verificadores,"['toca', 'ser', 'verificadores']",j venes usan sus redes para desmentir rumores oficia nos toca a nosotros ser los verificadores,1
98,Frankenstein,Frankenstein se proyecta en la Cineteca Nacional,Cineteca Agenda,28/10/2025,Funciï¿½ï¿½n especial con presencia de crï¿½ï,Verla en la Cineteca es un ritual.,,48,7,45,6,34,7,frankenstein se proyecta en la cineteca nacional,"['frankenstein', 'proyecta', 'cineteca', 'nacional']",funci n especial con presencia de cr,"['funci', 'especial', 'presencia']",verla en la cineteca es un ritual,"['verla', 'cineteca', 'ritual']",funci n especial con presencia de cr verla en la cineteca es un ritual,0
99,Generacion Z,Impacto en la cultura pop: Mï¿½ï¿½sicos se unen a la prot,Rolling Stone MX,17/11/2025,Bandas de rock y rap se pronuncian y donan fondos.,La mï¿½ï¿½sica siempre ha estado con el movimie,,57,11,50,10,47,8,impacto en la cultura pop m sicos se unen a la prot,"['impacto', 'cultura', 'pop', 'sicos', 'unen', 'prot']",bandas de rock y rap se pronuncian y donan fondos,"['bandas', 'rock', 'rap', 'pronuncian', 'donan', 'fondos']",la m sica siempre ha estado con el movimie,"['sica', 'siempre', 'movimie']",bandas de rock y rap se pronuncian y donan fondos la m sica siempre ha estado con el movimie,0
100,Frankenstein,La controversia del casting en redes sociales,Twitter Debate,04/11/2025,Discusiï¿½ï¿½n sobre la elecciï¿½ï¿½n de un actor 'demasiado,"El maquillaje lo arregla, pero la esencia es Del Toro.",,45,7,60,8,54,10,la controversia del casting en redes sociales,"['controversia', 'casting', 'redes', 'sociales']",discusi n sobre la elecci n de un actor demasiado,"['discusi', 'elecci', 'actor', 'demasiado']",el maquillaje lo arregla pero la esencia es del toro,"['maquillaje', 'arregla', 'esencia', 'toro']",discusi n sobre la elecci n de un actor demasiado el maquillaje lo arregla pero la esencia es del toro,2
101,Generacion Z,Gen Z-styled protests spread in Mexico,Reuters,16/11/2025,Protestas tras asesinato de alcalde; enfrentamientos con policï¿½ï,El hartazgo juvenil es evidente en cada pancarta.,,38,6,66,8,49,8,gen z styled protests spread in mexico,"['gen', 'styled', 'protests', 'spread', 'mexico']",protestas tras asesinato de alcalde enfrentamientos con polic,"['protestas', 'tras', 'asesinato', 'alcalde', 'enfrentamientos', 'polic']",el hartazgo juvenil es evidente en cada pancarta,"['hartazgo', 'juvenil', 'evidente', 'cada', 'pancarta']",protestas tras asesinato de alcalde enfrentamientos con polic el hartazgo juvenil es evidente en cada pancarta,1
102,Frankenstein,Frankenstein ya en streaming,Netflix Tudum,07/11/2025,La pelï¿½ï¿½cula se estrena en Netflix; estructura en tres ac,"La mejor adaptaciï¿½ï¿½n del clï¿½ï¿½sico en dï¿½ï¿½cadas, ï",,28,4,61,10,60,8,frankenstein ya en streaming,"['frankenstein', 'streaming']",la pel cula se estrena en netflix estructura en tres ac,"['pel', 'cula', 'estrena', 'netflix', 'estructura', 'tres']",la mejor adaptaci n del cl sico en d cadas,"['mejor', 'adaptaci', 'sico', 'cadas']",la pel cula se estrena en netflix estructura en tres ac la mejor adaptaci n del cl sico en d cadas,2
103,Generacion Z,Sheinbaum desautoriza marcha de la generaciï¿½ï¿,El Paï¿½,17/11/2025,Gobierno seï¿½ï¿½ala baja participaciï¿½ï¿½n juvenil y presencia de opositores ,"No importa cuï¿½ï¿½ntos ï¿½ï¿½ramos, sino el mensaje qu",,48,6,79,9,55,8,sheinbaum desautoriza marcha de la generaci,"['sheinbaum', 'desautoriza', 'marcha', 'generaci']",gobierno se ala baja participaci n juvenil y presencia de opositores,"['gobierno', 'ala', 'baja', 'participaci', 'juvenil', 'presencia', 'opositores']",no importa cu ntos ramos sino el mensaje qu,"['importa', 'ntos', 'ramos', 'sino', 'mensaje']",gobierno se ala baja participaci n juvenil y presencia de opositores no importa cu ntos ramos sino el mensaje qu,2
104,Frankenstein,Del Toro visita CDMX por estreno,Milenio,30/10/2025,Del Toro y elenco asistirï¿½ï¿½n a evento en Ciudad de Mï¿½,Mï¿½ï¿½xico celebra a su genio del cine. ï¿½ï¿½Un ,,32,6,59,11,50,8,del toro visita cdmx por estreno,"['toro', 'visita', 'cdmx', 'estreno']",del toro y elenco asistir n a evento en ciudad de m,"['toro', 'elenco', 'asistir', 'evento', 'ciudad']",m xico celebra a su genio del cine un,"['xico', 'celebra', 'genio', 'cine']",del toro y elenco asistir n a evento en ciudad de m m xico celebra a su genio del cine un,2
105,Generacion Z,Gobierno vincula marcha con desinformaciï¿½,El Paï¿½,13/11/2025,Acusan campaï¿½ï¿½a digital financiada con bots e influenc,"Si el gobierno lo niega, es porque es verdad lo que decimos.",,43,5,58,8,60,12,gobierno vincula marcha con desinformaci,"['gobierno', 'vincula', 'marcha', 'desinformaci']",acusan campa a digital financiada con bots e influenc,"['acusan', 'campa', 'digital', 'financiada', 'bots', 'influenc']",si el gobierno lo niega es porque es verdad lo que decimos,"['gobierno', 'niega', 'verdad', 'decimos']",acusan campa a digital financiada con bots e influenc si el gobierno lo niega es porque es verdad lo que decimos,0
106,Frankenstein,Estreno en cines mexicanos,TV Azteca,23/10/2025,Se proyecta solo en cines seleccionados e independientes.,Una experiencia cinematogrï¿½ï¿½fica que vale cada p,,26,4,57,8,52,7,estreno en cines mexicanos,"['estreno', 'cines', 'mexicanos']",se proyecta solo en cines seleccionados e independientes,"['proyecta', 'solo', 'cines', 'seleccionados', 'independientes']",una experiencia cinematogr fica que vale cada p,"['experiencia', 'cinematogr', 'fica', 'vale', 'cada']",se proyecta solo en cines seleccionados e independientes una experiencia cinematogr fica que vale cada p,1
107,Generacion Z,Generaciï¿½ï¿½n Z toma las ca,Euronews,16/11/2025,20 detenidos y 100 policï¿½ï¿½as heridos en movilizacio,La tensiï¿½ï¿½n en las calles es insosteni,,29,5,55,8,42,7,generaci n z toma las ca,"['generaci', 'toma']",20 detenidos y 100 polic as heridos en movilizacio,"['detenidos', '100', 'polic', 'heridos', 'movilizacio']",la tensi n en las calles es insosteni,"['tensi', 'calles', 'insosteni']",20 detenidos y 100 polic as heridos en movilizacio la tensi n en las calles es insosteni,1
108,Frankenstein,Frankenstein llega a Netflix,El Financiero,04/11/2025,Disponible en streaming desde el 7 de noviembre.,Lista para verla 3 veces seguidas. ï¿½ï¿½Quï¿½ï,,28,4,48,8,47,7,frankenstein llega a netflix,"['frankenstein', 'llega', 'netflix']",disponible en streaming desde el 7 de noviembre,"['disponible', 'streaming', 'noviembre']",lista para verla 3 veces seguidas qu,"['lista', 'verla', 'veces', 'seguidas']",disponible en streaming desde el 7 de noviembre lista para verla 3 veces seguidas qu,1
109,Generacion Z,Testimonios de jï¿½ï¿½venes sobre prot,El Paï¿½,16/11/2025,"Jï¿½ï¿½venes denuncian inseguridad, falta de medicinas y problemas socia","La protesta es multifactorial, no es solo un tema.",,38,5,72,9,50,9,testimonios de j venes sobre prot,"['testimonios', 'venes', 'prot']",j venes denuncian inseguridad falta de medicinas y problemas socia,"['venes', 'denuncian', 'inseguridad', 'falta', 'medicinas', 'problemas', 'socia']",la protesta es multifactorial no es solo un tema,"['protesta', 'multifactorial', 'solo', 'tema']",j venes denuncian inseguridad falta de medicinas y problemas socia la protesta es multifactorial no es solo un tema,3
110,Frankenstein,13 minutos de aplausos en Venecia,El Financiero,31/08/2025,La pelï¿½ï¿½cula recibe ovaciï¿½ï¿½n en el Festival de ,Merecidos aplausos para el maestro Del Toro.,,33,6,55,8,44,7,13 minutos de aplausos en venecia,"['minutos', 'aplausos', 'venecia']",la pel cula recibe ovaci n en el festival de,"['pel', 'cula', 'recibe', 'ovaci', 'festival']",merecidos aplausos para el maestro del toro,"['merecidos', 'aplausos', 'maestro', 'toro']",la pel cula recibe ovaci n en el festival de merecidos aplausos para el maestro del toro,0
111,Generacion Z,Anï¿½ï¿½lisis: ï¿½ï¿½Quï¿½ï¿½ busca realmente la Gen Z en ,BBC Mundo,18/11/2025,Estudio indica desconfianza en instituciones y uso de memes como protesta.,El meme es la herramienta de la sï¿½ï¿½tira polï¿½ï¿½tica ,,58,8,74,11,58,9,an lisis qu busca realmente la gen z en,"['lisis', 'busca', 'realmente', 'gen']",estudio indica desconfianza en instituciones y uso de memes como protesta,"['estudio', 'indica', 'desconfianza', 'instituciones', 'uso', 'memes', 'protesta']",el meme es la herramienta de la s tira pol tica,"['meme', 'herramienta', 'tira', 'pol', 'tica']",estudio indica desconfianza en instituciones y uso de memes como protesta el meme es la herramienta de la s tira pol tica,1
112,Frankenstein,Oscar a Mejor Maquillaje asegurado para GDT,Variety,15/11/2025,Expertos predicen mï¿½ï¿½ltiples nominaciones por el diseï¿½ï¿½o del M,El maquillaje te cuenta toda la historia del sufrimiento del Monstruo.,,43,7,70,9,70,11,oscar a mejor maquillaje asegurado para gdt,"['oscar', 'mejor', 'maquillaje', 'asegurado', 'gdt']",expertos predicen m ltiples nominaciones por el dise o del m,"['expertos', 'predicen', 'ltiples', 'nominaciones', 'dise']",el maquillaje te cuenta toda la historia del sufrimiento del monstruo,"['maquillaje', 'cuenta', 'toda', 'historia', 'sufrimiento', 'monstruo']",expertos predicen m ltiples nominaciones por el dise o del m el maquillaje te cuenta toda la historia del sufrimiento del monstruo,0
113,Generacion Z,El factor TikTok en las protestas mexicanas,DW,15/11/2025,La red social es la principal herramienta de convocatoria y difusiï¿½ï,El algoritmo nos uniï¿½ï¿½ por la ca,,43,7,70,11,36,7,el factor tiktok en las protestas mexicanas,"['factor', 'tiktok', 'protestas', 'mexicanas']",la red social es la principal herramienta de convocatoria y difusi,"['red', 'social', 'principal', 'herramienta', 'convocatoria', 'difusi']",el algoritmo nos uni por la ca,"['algoritmo', 'uni']",la red social es la principal herramienta de convocatoria y difusi el algoritmo nos uni por la ca,0
114,Frankenstein,La nueva visiï¿½ï¿½n de la criatura de Del ,Rolling Stone,08/11/2025,El director se enfoca en la soledad y la humanidad del Monstruo.,Es mï¿½ï¿½s sobre la vï¿½ï¿½ctima que sobre el ,,43,8,64,12,47,8,la nueva visi n de la criatura de del,"['nueva', 'visi', 'criatura']",el director se enfoca en la soledad y la humanidad del monstruo,"['director', 'enfoca', 'soledad', 'humanidad', 'monstruo']",es m s sobre la v ctima que sobre el,['ctima'],el director se enfoca en la soledad y la humanidad del monstruo es m s sobre la v ctima que sobre el,1
115,Generacion Z,Marcha: ï¿½ï¿½El inicio de un nuevo movimiento juve,Reforma,17/11/2025,Sociï¿½ï¿½logos debaten si las protestas tienen el potencial de la Primavera ï¿½,Los cambios generacionales empiezan con una chispa asï¿½,,51,8,80,12,56,8,marcha el inicio de un nuevo movimiento juve,"['marcha', 'inicio', 'nuevo', 'movimiento', 'juve']",soci logos debaten si las protestas tienen el potencial de la primavera,"['soci', 'logos', 'debaten', 'protestas', 'potencial', 'primavera']",los cambios generacionales empiezan con una chispa as,"['cambios', 'generacionales', 'empiezan', 'chispa']",soci logos debaten si las protestas tienen el potencial de la primavera los cambios generacionales empiezan con una chispa as,1
116,Frankenstein,Elenco de lujo cautiva a la audiencia global,Hollywood Reporter,09/11/2025,Anï¿½ï¿½lisis de las actuaciones de [Actor 1] y [Actor 2] como Dr. y Monst,[Actor 1] logra una frialdad increï¿½ï¿½ble como Dr. Frankenst,,44,8,74,14,62,9,elenco de lujo cautiva a la audiencia global,"['elenco', 'lujo', 'cautiva', 'audiencia', 'global']",an lisis de las actuaciones de actor 1 y actor 2 como dr y monst,"['lisis', 'actuaciones', 'actor', 'actor', 'monst']",actor 1 logra una frialdad incre ble como dr frankenst,"['actor', 'logra', 'frialdad', 'incre', 'ble', 'frankenst']",an lisis de las actuaciones de actor 1 y actor 2 como dr y monst actor 1 logra una frialdad incre ble como dr frankenst,1
117,Generacion Z,Gobierno refuerza seguridad en el Zï¿½ï¿½,Milenio,14/11/2025,"Tras el intento de ocupaciï¿½ï¿½n, se duplica la presencia polic",Blindan el poder en lugar de abrir el diï¿½ï¿½l,,41,6,64,10,47,9,gobierno refuerza seguridad en el z,"['gobierno', 'refuerza', 'seguridad']",tras el intento de ocupaci n se duplica la presencia polic,"['tras', 'intento', 'ocupaci', 'duplica', 'presencia', 'polic']",blindan el poder en lugar de abrir el di l,"['blindan', 'poder', 'lugar', 'abrir']",tras el intento de ocupaci n se duplica la presencia polic blindan el poder en lugar de abrir el di l,1
118,Frankenstein,Frankenstein: ï¿½ï¿½La obra maestra mï¿½ï¿½s oscura,IndieWire,10/11/2025,Comparaciï¿½ï¿½n con El Laberinto del Fauno y La Forma del A,"La mï¿½ï¿½s cruda y menos fantï¿½ï¿½stica, u",,51,6,60,11,44,7,frankenstein la obra maestra m s oscura,"['frankenstein', 'obra', 'maestra', 'oscura']",comparaci n con el laberinto del fauno y la forma del a,"['comparaci', 'laberinto', 'fauno', 'forma']",la m s cruda y menos fant stica u,"['cruda', 'menos', 'fant', 'stica']",comparaci n con el laberinto del fauno y la forma del a la m s cruda y menos fant stica u,3
