ID,Categoria,Titulo,Medio,Fecha,Resumen,Comentario_Reaccion,Unnamed: 7,Titulo_len_char,Titulo_len_words,Resumen_len_char,Resumen_len_words,Comentario_Reaccion_len_char,Comentario_Reaccion_len_words,Titulo_clean,Titulo_tokens,Resumen_clean,Resumen_tokens,Comentario_Reaccion_clean,Comentario_Reaccion_tokens,texto_combinado,tema_dominante
38,Frankenstein,El papel del color y la luz en la pelï¿½ï¿½,FilmeNow,06/11/2025,Anï¿½ï¿½lisis visual del director de fotograf,La paleta de colores es sombrï¿½ï¿½a y herm,,43,10,45,6,43,8,el papel del color y la luz en la pel,"['papel', 'color', 'luz', 'pel']",an lisis visual del director de fotograf,"['lisis', 'visual', 'director', 'fotograf']",la paleta de colores es sombr a y herm,"['paleta', 'colores', 'sombr', 'herm']",an lisis visual del director de fotograf la paleta de colores es sombr a y herm,0
39,Generacion Z,Gobierno acusa vandalismo en monumentos histï¿½ï¿½r,INAH,17/11/2025,Daï¿½ï¿½os en edificios y estatuas tras los enfrentamien,Una minorï¿½ï¿½a violenta desvï¿½ï¿½a la atenciï¿½ï¿½n de las dema,,51,6,56,8,66,9,gobierno acusa vandalismo en monumentos hist r,"['gobierno', 'acusa', 'vandalismo', 'monumentos', 'hist']",da os en edificios y estatuas tras los enfrentamien,"['edificios', 'estatuas', 'tras', 'enfrentamien']",una minor a violenta desv a la atenci n de las dema,"['minor', 'violenta', 'desv', 'atenci', 'dema']",da os en edificios y estatuas tras los enfrentamien una minor a violenta desv a la atenci n de las dema,0
40,Frankenstein,Estreno de Frankenstein genera debate en Reddit,Reddit r/movies,08/11/2025,Discusiï¿½ï¿½n sobre la adaptaciï¿½ï¿½n y la controversia del ,"Hay opiniones divididas, pero la mayorï¿½ï¿½a ama la direcciï¿½ï¿½n",,47,7,62,8,67,9,estreno de frankenstein genera debate en reddit,"['estreno', 'frankenstein', 'genera', 'debate', 'reddit']",discusi n sobre la adaptaci n y la controversia del,"['discusi', 'adaptaci', 'controversia']",hay opiniones divididas pero la mayor a ama la direcci n,"['opiniones', 'divididas', 'mayor', 'ama', 'direcci']",discusi n sobre la adaptaci n y la controversia del hay opiniones divididas pero la mayor a ama la direcci n,3
41,Generacion Z,Movilizaciï¿½ï¿½n: ï¿½ï¿½Una ola organizada o espo,El Paï¿½,18/11/2025,Expertos debaten la naturaleza del movimiento juvenil.,Es espontï¿½ï¿½neo pero con un sentimiento colect,,50,6,54,7,49,7,movilizaci n una ola organizada o espo,"['movilizaci', 'ola', 'organizada', 'espo']",expertos debaten la naturaleza del movimiento juvenil,"['expertos', 'debaten', 'naturaleza', 'movimiento', 'juvenil']",es espont neo pero con un sentimiento colect,"['espont', 'neo', 'sentimiento', 'colect']",expertos debaten la naturaleza del movimiento juvenil es espont neo pero con un sentimiento colect,1
42,Frankenstein,"Actores describen el proceso de maquillaje como ""tortuoso""",The Hollywood Reporter,11/11/2025,Horas de trabajo diario para lograr la apariencia del Monstruo.,El compromiso del actor es admirable.,,58,8,63,10,37,6,actores describen el proceso de maquillaje como tortuoso,"['actores', 'describen', 'proceso', 'maquillaje', 'tortuoso']",horas de trabajo diario para lograr la apariencia del monstruo,"['horas', 'trabajo', 'diario', 'lograr', 'apariencia', 'monstruo']",el compromiso del actor es admirable,"['compromiso', 'actor', 'admirable']",horas de trabajo diario para lograr la apariencia del monstruo el compromiso del actor es admirable,0
43,Generacion Z,Anï¿½ï¿½lisis de lenguaje visual de la prot,Diseï¿½ï¿½,15/11/2025,Uso de carteles minimalistas y referencias a memes.,El diseï¿½ï¿½o comunica mï¿½ï¿½s que un discurs,,43,7,51,8,47,7,an lisis de lenguaje visual de la prot,"['lisis', 'lenguaje', 'visual', 'prot']",uso de carteles minimalistas y referencias a memes,"['uso', 'carteles', 'minimalistas', 'referencias', 'memes']",el dise o comunica m s que un discurs,"['dise', 'comunica', 'discurs']",uso de carteles minimalistas y referencias a memes el dise o comunica m s que un discurs,3
44,Frankenstein,La mï¿½ï¿½sica de [Compositor] eleva la emoc,Soundtrack World,05/11/2025,Reseï¿½ï¿½a de la banda sonora de la pelï¿½,La mï¿½ï¿½sica es ï¿½ï¿½pica y melancï¿½ï¿½lic,,44,7,43,8,46,6,la m sica de compositor eleva la emoc,"['sica', 'compositor', 'eleva', 'emoc']",rese a de la banda sonora de la pel,"['rese', 'banda', 'sonora', 'pel']",la m sica es pica y melanc lic,"['sica', 'pica', 'melanc', 'lic']",rese a de la banda sonora de la pel la m sica es pica y melanc lic,3
45,Generacion Z,Jï¿½ï¿½venes convocan a una segunda marcha en dicie,Redes Sociales,17/11/2025,La convocatoria es para el dï¿½ï¿½a 10 de diciem,No nos cansaremos hasta ser escuchados.,,51,8,48,9,39,6,j venes convocan a una segunda marcha en dicie,"['venes', 'convocan', 'segunda', 'marcha', 'dicie']",la convocatoria es para el d a 10 de diciem,"['convocatoria', 'diciem']",no nos cansaremos hasta ser escuchados,"['cansaremos', 'ser', 'escuchados']",la convocatoria es para el d a 10 de diciem no nos cansaremos hasta ser escuchados,2
46,Frankenstein,Comparativa: ï¿½ï¿½Mejor que las versiones clï¿½ï,Den of Geek,07/11/2025,El artï¿½ï¿½culo compara la nueva versiï¿½ï¿½n con las de la Un,"Es diferente, pero respeta el alma del mito.",,49,6,63,11,44,8,comparativa mejor que las versiones cl,"['comparativa', 'mejor', 'versiones']",el art culo compara la nueva versi n con las de la un,"['art', 'culo', 'compara', 'nueva', 'versi']",es diferente pero respeta el alma del mito,"['diferente', 'respeta', 'alma', 'mito']",el art culo compara la nueva versi n con las de la un es diferente pero respeta el alma del mito,0
47,Generacion Z,Marcha: Un grito contra la corrupciï¿½ï¿½n y la impun,W Radio,16/11/2025,Las demandas centrales giran en torno a la justicia.,Queremos justicia por todos los crï¿½ï¿½menes impu,,53,9,52,9,50,7,marcha un grito contra la corrupci n y la impun,"['marcha', 'grito', 'corrupci', 'impun']",las demandas centrales giran en torno a la justicia,"['demandas', 'centrales', 'giran', 'torno', 'justicia']",queremos justicia por todos los cr menes impu,"['queremos', 'justicia', 'menes', 'impu']",las demandas centrales giran en torno a la justicia queremos justicia por todos los cr menes impu,0
48,Frankenstein,"Del Toro: ""El Monstruo es el niï¿½ï¿½o he""",Entrevista Televisa,04/11/2025,El director explica su enfoque psicolï¿½ï¿½gico del person,Una visiï¿½ï¿½n tierna y trï¿½ï¿½gica a,,42,8,58,8,39,6,del toro el monstruo es el ni o he,"['toro', 'monstruo']",el director explica su enfoque psicol gico del person,"['director', 'explica', 'enfoque', 'psicol', 'gico', 'person']",una visi n tierna y tr gica a,"['visi', 'tierna', 'gica']",el director explica su enfoque psicol gico del person una visi n tierna y tr gica a,0
49,Generacion Z,Testimonios: Jï¿½ï¿½venes que fueron por primera vez a mar,Aristegui Noticias,18/11/2025,Historias de la experiencia inicial en las protestas.,"Sentï¿½ï¿½ miedo, pero tambiï¿½ï¿½n mucha esperanza al ver a tantos j",,58,9,53,8,69,11,testimonios j venes que fueron por primera vez a mar,"['testimonios', 'venes', 'primera', 'vez', 'mar']",historias de la experiencia inicial en las protestas,"['historias', 'experiencia', 'inicial', 'protestas']",sent miedo pero tambi n mucha esperanza al ver a tantos j,"['sent', 'miedo', 'tambi', 'mucha', 'esperanza', 'ver', 'tantos']",historias de la experiencia inicial en las protestas sent miedo pero tambi n mucha esperanza al ver a tantos j,1
50,Frankenstein,ýýxito de taquilla limitada en cines independientes,Box Office Guru,13/11/2025,La pelï¿½ï¿½cula tuvo buenas cifras antes de pasar a stream,"Vale la pena pagar el cine, es una experiencia inmersiva.",,51,7,59,10,57,10,xito de taquilla limitada en cines independientes,"['xito', 'taquilla', 'limitada', 'cines', 'independientes']",la pel cula tuvo buenas cifras antes de pasar a stream,"['pel', 'cula', 'buenas', 'cifras', 'pasar', 'stream']",vale la pena pagar el cine es una experiencia inmersiva,"['vale', 'pena', 'pagar', 'cine', 'experiencia', 'inmersiva']",la pel cula tuvo buenas cifras antes de pasar a stream vale la pena pagar el cine es una experiencia inmersiva,0
51,Generacion Z,Movilizaciï¿½ï¿½n en Guadalajara y Monte,El Norte,16/11/2025,Las protestas se replican en otros estados clave.,"No es solo CDMX, la inconformidad es nacional.",,40,5,49,8,46,8,movilizaci n en guadalajara y monte,"['movilizaci', 'guadalajara', 'monte']",las protestas se replican en otros estados clave,"['protestas', 'replican', 'clave']",no es solo cdmx la inconformidad es nacional,"['solo', 'cdmx', 'inconformidad', 'nacional']",las protestas se replican en otros estados clave no es solo cdmx la inconformidad es nacional,1
52,Frankenstein,Del Toro explica el final alternativo,Revista Empire,15/11/2025,Detalles sobre las escenas eliminadas y cambios de guion.,"Interesante, pero el final que eligiï¿½ï¿½ es perfe",,37,6,57,9,51,8,del toro explica el final alternativo,"['toro', 'explica', 'final', 'alternativo']",detalles sobre las escenas eliminadas y cambios de guion,"['detalles', 'escenas', 'eliminadas', 'cambios', 'guion']",interesante pero el final que eligi es perfe,"['interesante', 'final', 'eligi', 'perfe']",detalles sobre las escenas eliminadas y cambios de guion interesante pero el final que eligi es perfe,3
53,Generacion Z,Debate en Twitter: ï¿½ï¿½Falta de liderazgo en la Ge,El Universal,17/11/2025,Algunos critican la falta de una figura central en el movimiento.,"No necesitamos lï¿½ï¿½deres, somos una red distribu",,52,9,65,11,51,7,debate en twitter falta de liderazgo en la ge,"['debate', 'twitter', 'falta', 'liderazgo']",algunos critican la falta de una figura central en el movimiento,"['critican', 'falta', 'figura', 'central', 'movimiento']",no necesitamos l deres somos una red distribu,"['necesitamos', 'deres', 'red', 'distribu']",algunos critican la falta de una figura central en el movimiento no necesitamos l deres somos una red distribu,2
54,Frankenstein,Anï¿½ï¿½lisis del vestuario como herramienta narra,Vogue Mï¿½ï¿½,08/11/2025,La ropa refleja el estatus y la decadencia moral.,"El vestuario es sombrï¿½ï¿½o y elegante, muy ",,50,6,49,9,45,7,an lisis del vestuario como herramienta narra,"['lisis', 'vestuario', 'herramienta', 'narra']",la ropa refleja el estatus y la decadencia moral,"['ropa', 'refleja', 'estatus', 'decadencia', 'moral']",el vestuario es sombr o y elegante muy,"['vestuario', 'sombr', 'elegante']",la ropa refleja el estatus y la decadencia moral el vestuario es sombr o y elegante muy,3
55,Generacion Z,Reporte: Uso de VPN y Tor para comunicaciï¿½ï¿½n se,TechCrunch,15/11/2025,La Gen Z utiliza herramientas digitales para evadir vigilancia.,La seguridad digital es parte de la protesta.,,51,9,63,9,45,8,reporte uso de vpn y tor para comunicaci n se,"['reporte', 'uso', 'vpn', 'tor', 'comunicaci']",la gen z utiliza herramientas digitales para evadir vigilancia,"['gen', 'utiliza', 'herramientas', 'digitales', 'evadir', 'vigilancia']",la seguridad digital es parte de la protesta,"['seguridad', 'digital', 'parte', 'protesta']",la gen z utiliza herramientas digitales para evadir vigilancia la seguridad digital es parte de la protesta,2
56,Frankenstein,Netflix compra los derechos globales por una cifra millonaria,Deadline,25/10/2025,El acuerdo garantiza una distribuciï¿½ï¿½n mas,La ï¿½ï¿½nica forma de verla es con una buena platafo,,61,9,46,6,53,10,netflix compra los derechos globales por una cifra millonaria,"['netflix', 'compra', 'derechos', 'globales', 'cifra', 'millonaria']",el acuerdo garantiza una distribuci n mas,"['acuerdo', 'garantiza', 'distribuci', 'mas']",la nica forma de verla es con una buena platafo,"['nica', 'forma', 'verla', 'buena', 'platafo']",el acuerdo garantiza una distribuci n mas la nica forma de verla es con una buena platafo,1
57,Generacion Z,El lenguaje inclusivo y la Gen Z en la protesta,Cultura Colectiva,16/11/2025,Anï¿½ï¿½lisis del vocabulario utilizado en las consig,La Gen Z trae consigo una nueva forma de hablar y protestar.,,47,10,53,7,60,12,el lenguaje inclusivo y la gen z en la protesta,"['lenguaje', 'inclusivo', 'gen', 'protesta']",an lisis del vocabulario utilizado en las consig,"['lisis', 'vocabulario', 'utilizado', 'consig']",la gen z trae consigo una nueva forma de hablar y protestar,"['gen', 'trae', 'consigo', 'nueva', 'forma', 'hablar', 'protestar']",an lisis del vocabulario utilizado en las consig la gen z trae consigo una nueva forma de hablar y protestar,1
58,Frankenstein,"Del Toro sobre el CGI: ""Solo donde sea estrictamente necesario""",Video Production,06/11/2025,ýýnfasis en los efectos prýýcticos y la artesanýýa.,Se nota la mano de un maestro artesano.,,63,10,51,8,39,8,del toro sobre el cgi solo donde sea estrictamente necesario,"['toro', 'cgi', 'solo', 'estrictamente', 'necesario']",nfasis en los efectos pr cticos y la artesan a,"['nfasis', 'efectos', 'cticos', 'artesan']",se nota la mano de un maestro artesano,"['nota', 'mano', 'maestro', 'artesano']",nfasis en los efectos pr cticos y la artesan a se nota la mano de un maestro artesano,0
59,Generacion Z,Gobierno acusa a partidos de derecha de infiltrar la marcha,Milenio,14/11/2025,Argumentan que buscan desestabilizar la administraciï¿½ï,La vieja polï¿½ï¿½tica siempre tratando de manipular,,59,10,56,6,52,7,gobierno acusa a partidos de derecha de infiltrar la marcha,"['gobierno', 'acusa', 'partidos', 'derecha', 'infiltrar', 'marcha']",argumentan que buscan desestabilizar la administraci,"['argumentan', 'buscan', 'desestabilizar', 'administraci']",la vieja pol tica siempre tratando de manipular,"['vieja', 'pol', 'tica', 'siempre', 'tratando', 'manipular']",argumentan que buscan desestabilizar la administraci la vieja pol tica siempre tratando de manipular,1
60,Frankenstein,Frankenstein: El monstruo que nos obliga a vernos,Psicologï¿½ï¿½a y ,11/11/2025,Anï¿½ï¿½lisis psicolï¿½ï¿½gico de la relaciï¿½ï¿½n cread,Refleja nuestras propias inseguridades y rechazos.,,49,8,56,6,50,6,frankenstein el monstruo que nos obliga a vernos,"['frankenstein', 'monstruo', 'obliga', 'vernos']",an lisis psicol gico de la relaci n cread,"['lisis', 'psicol', 'gico', 'relaci', 'cread']",refleja nuestras propias inseguridades y rechazos,"['refleja', 'propias', 'inseguridades', 'rechazos']",an lisis psicol gico de la relaci n cread refleja nuestras propias inseguridades y rechazos,0
61,Generacion Z,Gen Z crea su propia narrativa en YouTube,YouTube Trends,16/11/2025,Canales de jï¿½ï¿½venes documentan la marcha sin filt,La mejor cobertura estï¿½ï¿½ en los canales independien,,41,8,53,8,55,8,gen z crea su propia narrativa en youtube,"['gen', 'crea', 'propia', 'narrativa', 'youtube']",canales de j venes documentan la marcha sin filt,"['canales', 'venes', 'documentan', 'marcha', 'filt']",la mejor cobertura est en los canales independien,"['mejor', 'cobertura', 'est', 'canales', 'independien']",canales de j venes documentan la marcha sin filt la mejor cobertura est en los canales independien,3
62,Frankenstein,La iluminaciï¿½ï¿½n como personaje en el film de Del ,Cinephilia,09/11/2025,Estudio de cï¿½ï¿½mo el claroscuro define el tono de la pelï¿½,Cada escena parece sacada de un cuadro barroco.,,53,9,62,11,47,8,la iluminaci n como personaje en el film de del,"['iluminaci', 'personaje', 'film']",estudio de c mo el claroscuro define el tono de la pel,"['estudio', 'claroscuro', 'define', 'tono', 'pel']",cada escena parece sacada de un cuadro barroco,"['cada', 'escena', 'parece', 'sacada', 'cuadro', 'barroco']",estudio de c mo el claroscuro define el tono de la pel cada escena parece sacada de un cuadro barroco,1
63,Generacion Z,Anï¿½ï¿½lisis: Diferencias con el movimiento estudiantil de,History Channel,18/11/2025,Comparativa entre el activismo actual y el pasado.,"Diferentes ï¿½ï¿½pocas, la misma necesidad de cam",,59,7,50,8,49,7,an lisis diferencias con el movimiento estudiantil de,"['lisis', 'diferencias', 'movimiento', 'estudiantil']",comparativa entre el activismo actual y el pasado,"['comparativa', 'activismo', 'actual', 'pasado']",diferentes pocas la misma necesidad de cam,"['diferentes', 'pocas', 'misma', 'necesidad', 'cam']",comparativa entre el activismo actual y el pasado diferentes pocas la misma necesidad de cam,2
64,Frankenstein,La visiï¿½ï¿½n del Dr. Frankenstein como un niï¿½ï¿½o ca,The New Yorker,12/11/2025,Crï¿½ï¿½tica que examina la inmadurez moral del cientï¿½,"El Dr. es el verdadero villano, un irresponsable narcisista.",,56,9,56,8,60,9,la visi n del dr frankenstein como un ni o ca,"['visi', 'frankenstein']",cr tica que examina la inmadurez moral del cient,"['tica', 'examina', 'inmadurez', 'moral', 'cient']",el dr es el verdadero villano un irresponsable narcisista,"['verdadero', 'villano', 'irresponsable', 'narcisista']",cr tica que examina la inmadurez moral del cient el dr es el verdadero villano un irresponsable narcisista,1
65,Generacion Z,Reporte de Derechos Humanos condena uso excesivo de la fuerza,Amnistï¿½ï¿½a Internaci,17/11/2025,Documentan agresiones a manifestantes pacï¿½ï¿½fi,El estado no respeta nuestros derechos.,,61,10,49,5,39,6,reporte de derechos humanos condena uso excesivo de la fuerza,"['reporte', 'derechos', 'humanos', 'condena', 'uso', 'excesivo', 'fuerza']",documentan agresiones a manifestantes pac fi,"['documentan', 'agresiones', 'manifestantes', 'pac']",el estado no respeta nuestros derechos,"['respeta', 'derechos']",documentan agresiones a manifestantes pac fi el estado no respeta nuestros derechos,0
66,Frankenstein,Guillermo del Toro anuncia un libro de arte de la pelï¿½ï¿½,Dark Horse Comics,14/11/2025,El tomo contendrï¿½ï¿½ bocetos y diseï¿½ï¿½os conce,ýýComprado! Necesito ver el proceso creativo de GDT.,,59,11,51,7,52,8,guillermo del toro anuncia un libro de arte de la pel,"['guillermo', 'toro', 'anuncia', 'libro', 'arte', 'pel']",el tomo contendr bocetos y dise os conce,"['tomo', 'contendr', 'bocetos', 'dise', 'conce']",comprado necesito ver el proceso creativo de gdt,"['comprado', 'necesito', 'ver', 'proceso', 'creativo', 'gdt']",el tomo contendr bocetos y dise os conce comprado necesito ver el proceso creativo de gdt,3
67,Generacion Z,Economistas advierten sobre el impacto de la inestabilidad social,Financial Times,18/11/2025,Las protestas pueden afectar la inversiï¿½ï¿½n extranj,La inestabilidad la crea el gobierno que no escucha.,,65,9,54,7,52,9,economistas advierten sobre el impacto de la inestabilidad social,"['economistas', 'advierten', 'impacto', 'inestabilidad', 'social']",las protestas pueden afectar la inversi n extranj,"['protestas', 'pueden', 'afectar', 'inversi', 'extranj']",la inestabilidad la crea el gobierno que no escucha,"['inestabilidad', 'crea', 'gobierno', 'escucha']",las protestas pueden afectar la inversi n extranj la inestabilidad la crea el gobierno que no escucha,1
68,Frankenstein,Frankenstein y el cine gï¿½ï¿½tico: Un regreso a las raï,Horror Freak,05/11/2025,La pelï¿½ï¿½cula abraza la tradiciï¿½ï¿½n del horror c,Un homenaje perfecto a los monstruos de antaï¿½ï,,56,10,54,8,48,8,frankenstein y el cine g tico un regreso a las ra,"['frankenstein', 'cine', 'tico', 'regreso']",la pel cula abraza la tradici n del horror c,"['pel', 'cula', 'abraza', 'tradici', 'horror']",un homenaje perfecto a los monstruos de anta,"['homenaje', 'perfecto', 'monstruos', 'anta']",la pel cula abraza la tradici n del horror c un homenaje perfecto a los monstruos de anta,1
69,Generacion Z,Manifestantes utilizan drones para documentar la marcha,Tecnologï¿½ï¿½a para el Ca,16/11/2025,Cï¿½ï¿½maras aï¿½ï¿½reas registran la magnitud de la concent,Los drones muestran la verdad que los medios no quieren ver.,,55,7,60,8,60,11,manifestantes utilizan drones para documentar la marcha,"['manifestantes', 'utilizan', 'drones', 'documentar', 'marcha']",c maras a reas registran la magnitud de la concent,"['maras', 'reas', 'registran', 'magnitud', 'concent']",los drones muestran la verdad que los medios no quieren ver,"['drones', 'muestran', 'verdad', 'medios', 'quieren', 'ver']",c maras a reas registran la magnitud de la concent los drones muestran la verdad que los medios no quieren ver,2
70,Frankenstein,"Del Toro agradece el recibimiento: ""Una obra personal""",Discurso de Premiere,30/10/2025,El director se emociona al hablar de su conexiï¿½ï¿½n con la histo,Se siente la pasiï¿½ï¿½n en cada fotogr,,54,8,66,12,39,7,del toro agradece el recibimiento una obra personal,"['toro', 'agradece', 'recibimiento', 'obra', 'personal']",el director se emociona al hablar de su conexi n con la histo,"['director', 'emociona', 'hablar', 'conexi', 'histo']",se siente la pasi n en cada fotogr,"['pasi', 'cada', 'fotogr']",el director se emociona al hablar de su conexi n con la histo se siente la pasi n en cada fotogr,1
71,Generacion Z,Comentarios: La marcha dividiï¿½ï¿½ a las fami,Foros de Debate,17/11/2025,Generaciones mayores critican la falta de respeto a la autoridad.,Mis papï¿½ï¿½s no entienden por quï¿½ï¿½ salgo a l,,46,7,65,10,50,9,comentarios la marcha dividi a las fami,"['comentarios', 'marcha', 'dividi', 'fami']",generaciones mayores critican la falta de respeto a la autoridad,"['generaciones', 'mayores', 'critican', 'falta', 'respeto', 'autoridad']",mis pap s no entienden por qu salgo a l,"['pap', 'entienden', 'salgo']",generaciones mayores critican la falta de respeto a la autoridad mis pap s no entienden por qu salgo a l,0
72,Frankenstein,El Monstruo de Del Toro: ï¿½ï¿½El mï¿½ï¿½s vulnerable d,Film Comment,10/11/2025,El anï¿½ï¿½lisis de la interpretaciï¿½ï¿½n de [Actor 2] como figura t,Su vulnerabilidad es lo que lo hace tan humano.,,55,9,69,11,47,9,el monstruo de del toro el m s vulnerable d,"['monstruo', 'toro', 'vulnerable']",el an lisis de la interpretaci n de actor 2 como figura t,"['lisis', 'interpretaci', 'actor', 'figura']",su vulnerabilidad es lo que lo hace tan humano,"['vulnerabilidad', 'hace', 'tan', 'humano']",el an lisis de la interpretaci n de actor 2 como figura t su vulnerabilidad es lo que lo hace tan humano,3
73,Generacion Z,Influencers promueven boicot a marcas que no se pronuncian,TikTok,15/11/2025,Piden a las empresas tomar posiciï¿½ï¿½n polï¿½,"Si las marcas no nos apoyan, no las consumimos.",,58,9,47,7,47,9,influencers promueven boicot a marcas que no se pronuncian,"['influencers', 'promueven', 'boicot', 'marcas', 'pronuncian']",piden a las empresas tomar posici n pol,"['piden', 'empresas', 'tomar', 'posici', 'pol']",si las marcas no nos apoyan no las consumimos,"['marcas', 'apoyan', 'consumimos']",piden a las empresas tomar posici n pol si las marcas no nos apoyan no las consumimos,2
74,Frankenstein,Frankenstein: Un ï¿½ï¿½xito inesperado de Netflix L,Netflix Data,14/11/2025,La pelï¿½ï¿½cula se posiciona como la mï¿½ï¿½s vista en la ,ýýQuýý orgullo para un director mexicano!,,51,7,59,10,41,6,frankenstein un xito inesperado de netflix l,"['frankenstein', 'xito', 'inesperado', 'netflix']",la pel cula se posiciona como la m s vista en la,"['pel', 'cula', 'posiciona', 'vista']",qu orgullo para un director mexicano,"['orgullo', 'director', 'mexicano']",la pel cula se posiciona como la m s vista en la qu orgullo para un director mexicano,2
75,Generacion Z,La voz de la Generaciï¿½ï¿½n Z en los medios tradicion,Prensa Libre,18/11/2025,Los medios dan mï¿½ï¿½s espacio a las demandas de los jï¿½ï,Es bueno que por fin nos escuchen en la radio.,,54,10,59,11,46,10,la voz de la generaci n z en los medios tradicion,"['voz', 'generaci', 'medios', 'tradicion']",los medios dan m s espacio a las demandas de los j,"['medios', 'dan', 'espacio', 'demandas']",es bueno que por fin nos escuchen en la radio,"['bueno', 'fin', 'escuchen', 'radio']",los medios dan m s espacio a las demandas de los j es bueno que por fin nos escuchen en la radio,0
76,Frankenstein,"Del Toro sobre el final: ""Un toque de esperanza""",Entrevista Exclusiva,07/11/2025,El director defiende un cierre menos nihilista.,Un final con esa pequeï¿½ï¿½a luz es muy Del T,,48,9,47,7,46,10,del toro sobre el final un toque de esperanza,"['toro', 'final', 'toque', 'esperanza']",el director defiende un cierre menos nihilista,"['director', 'defiende', 'cierre', 'menos', 'nihilista']",un final con esa peque a luz es muy del t,"['final', 'peque', 'luz']",el director defiende un cierre menos nihilista un final con esa peque a luz es muy del t,2
77,Generacion Z,Activistas denuncian detenciones arbitrarias,ONG Derechos Humanos,16/11/2025,Piden la liberaciï¿½ï¿½n inmediata de los deteni,La represiï¿½ï¿½n es la respuesta del mi,,44,4,48,7,40,7,activistas denuncian detenciones arbitrarias,"['activistas', 'denuncian', 'detenciones', 'arbitrarias']",piden la liberaci n inmediata de los deteni,"['piden', 'liberaci', 'inmediata', 'deteni']",la represi n es la respuesta del mi,"['represi', 'respuesta']",piden la liberaci n inmediata de los deteni la represi n es la respuesta del mi,2
