ID,Categoria,Titulo,Medio,Fecha,Resumen,Comentario_Reaccion,Unnamed: 7,Titulo_len_char,Titulo_len_words,Resumen_len_char,Resumen_len_words,Comentario_Reaccion_len_char,Comentario_Reaccion_len_words,Titulo_clean,Titulo_tokens,Resumen_clean,Resumen_tokens,Comentario_Reaccion_clean,Comentario_Reaccion_tokens,texto_combinado,tema_dominante
1,Generacion Z,Gen Z-styled protests spread in Mexico,Reuters,16/11/2025,Protestas tras asesinato de alcalde; enfrentamientos con policï¿½ï,"Jï¿½ï¿½venes exigen seguridad, no sï¿½ï¿½lo retï¿½ï¿½rica polï¿½ï¿½tica.",,38,6,66,8,72,7,gen z styled protests spread in mexico,"['gen', 'styled', 'protests', 'spread', 'mexico']",protestas tras asesinato de alcalde enfrentamientos con polic,"['protestas', 'tras', 'asesinato', 'alcalde', 'enfrentamientos', 'polic']",j venes exigen seguridad no s lo ret rica pol tica,"['venes', 'exigen', 'seguridad', 'ret', 'rica', 'pol', 'tica']",protestas tras asesinato de alcalde enfrentamientos con polic j venes exigen seguridad no s lo ret rica pol tica,1
2,Frankenstein,Frankenstein ya en streaming,Netflix Tudum,07/11/2025,La pelï¿½ï¿½cula se estrena en Netflix; estructura en tres ac,"La versiï¿½ï¿½n de Del Toro es increï¿½ï¿½blemente emotiva, ï¿½ï¿½lï¿½ï¿½grimas garantizadas! ",,28,4,61,10,94,10,frankenstein ya en streaming,"['frankenstein', 'streaming']",la pel cula se estrena en netflix estructura en tres ac,"['pel', 'cula', 'estrena', 'netflix', 'estructura', 'tres']",la versi n de del toro es incre blemente emotiva l grimas garantizadas,"['versi', 'toro', 'incre', 'blemente', 'emotiva', 'grimas', 'garantizadas']",la pel cula se estrena en netflix estructura en tres ac la versi n de del toro es incre blemente emotiva l grimas garantizadas,2
3,Generacion Z,Sheinbaum desautoriza marcha de la generaciï¿½ï¿,El Paï¿½,17/11/2025,Gobierno seï¿½ï¿½ala baja participaciï¿½ï¿½n juvenil y presencia de opositores ,"Dicen que somos pocos, pero el ruido que hacemos es por todos. #SomosMas",,48,6,79,9,72,13,sheinbaum desautoriza marcha de la generaci,"['sheinbaum', 'desautoriza', 'marcha', 'generaci']",gobierno se ala baja participaci n juvenil y presencia de opositores,"['gobierno', 'ala', 'baja', 'participaci', 'juvenil', 'presencia', 'opositores']",dicen que somos pocos pero el ruido que hacemos es por todos #somosmas,"['dicen', 'pocos', 'ruido', 'hacemos', '#somosmas']",gobierno se ala baja participaci n juvenil y presencia de opositores dicen que somos pocos pero el ruido que hacemos es por todos #somosmas,0
4,Frankenstein,Del Toro visita CDMX por estreno,Milenio,30/10/2025,Del Toro y elenco asistirï¿½ï¿½n a evento en Ciudad de Mï¿½,"Necesito ir a la alfombra roja, GDT es un ï¿½ï¿½dolo de la estï¿½ï¿½tica gï¿½ï¿",,32,6,59,11,79,14,del toro visita cdmx por estreno,"['toro', 'visita', 'cdmx', 'estreno']",del toro y elenco asistir n a evento en ciudad de m,"['toro', 'elenco', 'asistir', 'evento', 'ciudad']",necesito ir a la alfombra roja gdt es un dolo de la est tica g,"['necesito', 'alfombra', 'roja', 'gdt', 'dolo', 'est', 'tica']",del toro y elenco asistir n a evento en ciudad de m necesito ir a la alfombra roja gdt es un dolo de la est tica g,3
5,Generacion Z,Gobierno vincula marcha con desinformaciï¿½,El Paï¿½,13/11/2025,Acusan campaï¿½ï¿½a digital financiada con bots e influenc,Siempre es mï¿½ï¿½s fï¿½ï¿½cil culpar a los bots que escuchar la calle. #No,,43,5,58,8,75,13,gobierno vincula marcha con desinformaci,"['gobierno', 'vincula', 'marcha', 'desinformaci']",acusan campa a digital financiada con bots e influenc,"['acusan', 'campa', 'digital', 'financiada', 'bots', 'influenc']",siempre es m s f cil culpar a los bots que escuchar la calle #no,"['siempre', 'cil', 'culpar', 'bots', 'escuchar', 'calle', '#no']",acusan campa a digital financiada con bots e influenc siempre es m s f cil culpar a los bots que escuchar la calle #no,1
6,Frankenstein,Estreno en cines mexicanos,TV Azteca,23/10/2025,Se proyecta solo en cines seleccionados e independientes.,Una obra maestra que DEBE verse en pantalla grande. El sonido es vital.,,26,4,57,8,71,13,estreno en cines mexicanos,"['estreno', 'cines', 'mexicanos']",se proyecta solo en cines seleccionados e independientes,"['proyecta', 'solo', 'cines', 'seleccionados', 'independientes']",una obra maestra que debe verse en pantalla grande el sonido es vital,"['obra', 'maestra', 'debe', 'verse', 'pantalla', 'grande', 'sonido', 'vital']",se proyecta solo en cines seleccionados e independientes una obra maestra que debe verse en pantalla grande el sonido es vital,1
7,Generacion Z,Generaciï¿½ï¿½n Z toma las ca,Euronews,16/11/2025,20 detenidos y 100 policï¿½ï¿½as heridos en movilizacio,"Los enfrentamientos escalaron. Piden diï¿½ï¿½logo, no represi",,29,5,55,8,61,7,generaci n z toma las ca,"['generaci', 'toma']",20 detenidos y 100 polic as heridos en movilizacio,"['detenidos', '100', 'polic', 'heridos', 'movilizacio']",los enfrentamientos escalaron piden di logo no represi,"['enfrentamientos', 'escalaron', 'piden', 'logo', 'represi']",20 detenidos y 100 polic as heridos en movilizacio los enfrentamientos escalaron piden di logo no represi,2
8,Frankenstein,Frankenstein llega a Netflix,El Financiero,04/11/2025,Disponible en streaming desde el 7 de noviembre.,Perfecto para un maratï¿½ï¿½n de terror melancï¿½ï¿½lico este fin de,,28,4,48,8,68,10,frankenstein llega a netflix,"['frankenstein', 'llega', 'netflix']",disponible en streaming desde el 7 de noviembre,"['disponible', 'streaming', 'noviembre']",perfecto para un marat n de terror melanc lico este fin de,"['perfecto', 'marat', 'terror', 'melanc', 'lico', 'fin']",disponible en streaming desde el 7 de noviembre perfecto para un marat n de terror melanc lico este fin de,1
9,Generacion Z,Testimonios de jï¿½ï¿½venes sobre prot,El Paï¿½,16/11/2025,"Jï¿½ï¿½venes denuncian inseguridad, falta de medicinas y problemas socia",El grito es por el futuro que nos estï¿½ï¿½n robando. #MexicoDespi,,38,5,72,9,66,11,testimonios de j venes sobre prot,"['testimonios', 'venes', 'prot']",j venes denuncian inseguridad falta de medicinas y problemas socia,"['venes', 'denuncian', 'inseguridad', 'falta', 'medicinas', 'problemas', 'socia']",el grito es por el futuro que nos est n robando #mexicodespi,"['grito', 'futuro', 'est', 'robando', '#mexicodespi']",j venes denuncian inseguridad falta de medicinas y problemas socia el grito es por el futuro que nos est n robando #mexicodespi,3
10,Frankenstein,13 minutos de aplausos en Venecia,El Financiero,31/08/2025,La pelï¿½ï¿½cula recibe ovaciï¿½ï¿½n en el Festival de ,La crï¿½ï¿½tica la ama. Del Toro lo vuelve a hacer con el gï¿½ï¿½nero de mo,,33,6,55,8,75,15,13 minutos de aplausos en venecia,"['minutos', 'aplausos', 'venecia']",la pel cula recibe ovaci n en el festival de,"['pel', 'cula', 'recibe', 'ovaci', 'festival']",la cr tica la ama del toro lo vuelve a hacer con el g nero de mo,"['tica', 'ama', 'toro', 'vuelve', 'hacer', 'nero']",la pel cula recibe ovaci n en el festival de la cr tica la ama del toro lo vuelve a hacer con el g nero de mo,0
11,Generacion Z,Anï¿½ï¿½lisis: ï¿½ï¿½Quï¿½ï¿½ busca realmente la Gen Z en ,BBC Mundo,18/11/2025,Estudio indica desconfianza en instituciones y uso de memes como protesta.,"Usamos los memes para reï¿½ï¿½r, pero la indignaciï¿½ï¿½n es real. #Protest",,58,8,74,11,75,11,an lisis qu busca realmente la gen z en,"['lisis', 'busca', 'realmente', 'gen']",estudio indica desconfianza en instituciones y uso de memes como protesta,"['estudio', 'indica', 'desconfianza', 'instituciones', 'uso', 'memes', 'protesta']",usamos los memes para re r pero la indignaci n es real #protest,"['usamos', 'memes', 'indignaci', 'real', '#protest']",estudio indica desconfianza en instituciones y uso de memes como protesta usamos los memes para re r pero la indignaci n es real #protest,1
12,Frankenstein,Oscar a Mejor Maquillaje asegurado para GDT,Variety,15/11/2025,Expertos predicen mï¿½ï¿½ltiples nominaciones por el diseï¿½ï¿½o del M,El look del Monstruo es desgarradoramente bello. Del Toro y su estï¿½ï¿½t,,43,7,70,9,73,12,oscar a mejor maquillaje asegurado para gdt,"['oscar', 'mejor', 'maquillaje', 'asegurado', 'gdt']",expertos predicen m ltiples nominaciones por el dise o del m,"['expertos', 'predicen', 'ltiples', 'nominaciones', 'dise']",el look del monstruo es desgarradoramente bello del toro y su est t,"['look', 'monstruo', 'desgarradoramente', 'bello', 'toro', 'est']",expertos predicen m ltiples nominaciones por el dise o del m el look del monstruo es desgarradoramente bello del toro y su est t,2
13,Generacion Z,El factor TikTok en las protestas mexicanas,DW,15/11/2025,La red social es la principal herramienta de convocatoria y difusiï¿½ï,"Vi el live de la marcha en TikTok, mucho mï¿½ï¿½s rï¿½ï¿½pido que las n",,43,7,70,11,71,14,el factor tiktok en las protestas mexicanas,"['factor', 'tiktok', 'protestas', 'mexicanas']",la red social es la principal herramienta de convocatoria y difusi,"['red', 'social', 'principal', 'herramienta', 'convocatoria', 'difusi']",vi el live de la marcha en tiktok mucho m s r pido que las n,"['live', 'marcha', 'tiktok', 'pido']",la red social es la principal herramienta de convocatoria y difusi vi el live de la marcha en tiktok mucho m s r pido que las n,1
14,Frankenstein,La nueva visiï¿½ï¿½n de la criatura de Del ,Rolling Stone,08/11/2025,El director se enfoca en la soledad y la humanidad del Monstruo.,"No es solo terror, es drama existencial. Mary Shelley estarï¿½ï¿½a orgull",,43,8,64,12,73,11,la nueva visi n de la criatura de del,"['nueva', 'visi', 'criatura']",el director se enfoca en la soledad y la humanidad del monstruo,"['director', 'enfoca', 'soledad', 'humanidad', 'monstruo']",no es solo terror es drama existencial mary shelley estar a orgull,"['solo', 'terror', 'drama', 'existencial', 'mary', 'shelley', 'orgull']",el director se enfoca en la soledad y la humanidad del monstruo no es solo terror es drama existencial mary shelley estar a orgull,1
15,Generacion Z,Marcha: ï¿½ï¿½El inicio de un nuevo movimiento juve,Reforma,17/11/2025,Sociï¿½ï¿½logos debaten si las protestas tienen el potencial de la Primavera ï¿½,"Espero que sea el inicio de un cambio real, no solo un flash.",,51,8,80,12,61,13,marcha el inicio de un nuevo movimiento juve,"['marcha', 'inicio', 'nuevo', 'movimiento', 'juve']",soci logos debaten si las protestas tienen el potencial de la primavera,"['soci', 'logos', 'debaten', 'protestas', 'potencial', 'primavera']",espero que sea el inicio de un cambio real no solo un flash,"['espero', 'inicio', 'cambio', 'real', 'solo', 'flash']",soci logos debaten si las protestas tienen el potencial de la primavera espero que sea el inicio de un cambio real no solo un flash,1
16,Frankenstein,Elenco de lujo cautiva a la audiencia global,Hollywood Reporter,09/11/2025,Anï¿½ï¿½lisis de las actuaciones de [Actor 1] y [Actor 2] como Dr. y Monst,"[Actor 2] como el Monstruo es brutal, sin palabras.",,44,8,74,14,51,9,elenco de lujo cautiva a la audiencia global,"['elenco', 'lujo', 'cautiva', 'audiencia', 'global']",an lisis de las actuaciones de actor 1 y actor 2 como dr y monst,"['lisis', 'actuaciones', 'actor', 'actor', 'monst']",actor 2 como el monstruo es brutal sin palabras,"['actor', 'monstruo', 'brutal', 'palabras']",an lisis de las actuaciones de actor 1 y actor 2 como dr y monst actor 2 como el monstruo es brutal sin palabras,1
17,Generacion Z,Gobierno refuerza seguridad en el Zï¿½ï¿½,Milenio,14/11/2025,"Tras el intento de ocupaciï¿½ï¿½n, se duplica la presencia polic","Mucha seguridad para cuidar edificios, y poca para cuidar ciudadanos.",,41,6,64,10,69,10,gobierno refuerza seguridad en el z,"['gobierno', 'refuerza', 'seguridad']",tras el intento de ocupaci n se duplica la presencia polic,"['tras', 'intento', 'ocupaci', 'duplica', 'presencia', 'polic']",mucha seguridad para cuidar edificios y poca para cuidar ciudadanos,"['mucha', 'seguridad', 'cuidar', 'edificios', 'poca', 'cuidar', 'ciudadanos']",tras el intento de ocupaci n se duplica la presencia polic mucha seguridad para cuidar edificios y poca para cuidar ciudadanos,0
18,Frankenstein,Frankenstein: ï¿½ï¿½La obra maestra mï¿½ï¿½s oscura,IndieWire,10/11/2025,Comparaciï¿½ï¿½n con El Laberinto del Fauno y La Forma del A,"Mï¿½ï¿½s oscura, mï¿½ï¿½s profunda, mï¿½ï¿½s dolorosa. Del Toro en su ",,51,6,60,11,70,10,frankenstein la obra maestra m s oscura,"['frankenstein', 'obra', 'maestra', 'oscura']",comparaci n con el laberinto del fauno y la forma del a,"['comparaci', 'laberinto', 'fauno', 'forma']",m s oscura m s profunda m s dolorosa del toro en su,"['oscura', 'profunda', 'dolorosa', 'toro']",comparaci n con el laberinto del fauno y la forma del a m s oscura m s profunda m s dolorosa del toro en su,2
19,Generacion Z,ýýQuiýýn financia la movilizaciýýn digital de la Gen Z?,El Universal,13/11/2025,Investigaciï¿½ï¿½n sobre el origen de los hashtags vira,Es increï¿½ï¿½ble cï¿½ï¿½mo minimizan nuestra voz llamï¿½ï¿½ndola ',,55,9,55,8,67,8,qui n financia la movilizaci n digital de la gen z,"['qui', 'financia', 'movilizaci', 'digital', 'gen']",investigaci n sobre el origen de los hashtags vira,"['investigaci', 'origen', 'hashtags', 'vira']",es incre ble c mo minimizan nuestra voz llam ndola,"['incre', 'ble', 'minimizan', 'voz', 'llam', 'ndola']",investigaci n sobre el origen de los hashtags vira es incre ble c mo minimizan nuestra voz llam ndola,0
20,Frankenstein,La estï¿½ï¿½tica victoriana y el detalle de producc,Screen Rant,06/11/2025,Entrevista con la diseï¿½ï¿½adora de producciï¿½ï¿½n sobre el mundo de la pe,"Cada toma es una pintura, la direcciï¿½ï¿½n de arte es de otro mu",,51,8,76,12,65,13,la est tica victoriana y el detalle de producc,"['est', 'tica', 'victoriana', 'detalle', 'producc']",entrevista con la dise adora de producci n sobre el mundo de la pe,"['entrevista', 'dise', 'adora', 'producci', 'mundo']",cada toma es una pintura la direcci n de arte es de otro mu,"['cada', 'toma', 'pintura', 'direcci', 'arte']",entrevista con la dise adora de producci n sobre el mundo de la pe cada toma es una pintura la direcci n de arte es de otro mu,1
21,Generacion Z,Estudiantes se suman a las demandas de la marcha,La Jornada,15/11/2025,Facultades de la UNAM y el IPN emiten comunicados de apoyo.,Es un movimiento estudiantil y social. ï¿½ï¿½Todos jun,,48,9,59,11,54,8,estudiantes se suman a las demandas de la marcha,"['estudiantes', 'suman', 'demandas', 'marcha']",facultades de la unam y el ipn emiten comunicados de apoyo,"['facultades', 'unam', 'ipn', 'emiten', 'comunicados', 'apoyo']",es un movimiento estudiantil y social todos jun,"['movimiento', 'estudiantil', 'social', 'jun']",facultades de la unam y el ipn emiten comunicados de apoyo es un movimiento estudiantil y social todos jun,2
22,Frankenstein,Trï¿½ï¿½iler rompe rï¿½ï¿½cord de vistas en,Forbes,01/10/2025,El avance de la pelï¿½ï¿½cula se vuelve viral en ho,El trï¿½ï¿½iler me puso la piel de gallina. Del Toro sabe cï¿½ï¿½mo vender mo,,43,6,51,10,77,14,tr iler rompe r cord de vistas en,"['iler', 'rompe', 'cord', 'vistas']",el avance de la pel cula se vuelve viral en ho,"['avance', 'pel', 'cula', 'vuelve', 'viral']",el tr iler me puso la piel de gallina del toro sabe c mo vender mo,"['iler', 'puso', 'piel', 'gallina', 'toro', 'sabe', 'vender']",el avance de la pel cula se vuelve viral en ho el tr iler me puso la piel de gallina del toro sabe c mo vender mo,3
23,Generacion Z,Influencers denuncian intimidaciï¿½ï¿½n tras apoyar las prote,El Paï¿½,17/11/2025,Cuentas grandes reportan ataques coordinados y amenazas.,"Si apoyas la protesta, te atacan. Es un miedo constante.",,61,7,56,7,56,10,influencers denuncian intimidaci n tras apoyar las prote,"['influencers', 'denuncian', 'intimidaci', 'tras', 'apoyar', 'prote']",cuentas grandes reportan ataques coordinados y amenazas,"['cuentas', 'grandes', 'reportan', 'ataques', 'coordinados', 'amenazas']",si apoyas la protesta te atacan es un miedo constante,"['apoyas', 'protesta', 'atacan', 'miedo', 'constante']",cuentas grandes reportan ataques coordinados y amenazas si apoyas la protesta te atacan es un miedo constante,2
24,Frankenstein,"Del Toro sobre la ciencia: ""Es la ambiciï¿½ï¿½n hu""",The Guardian,07/11/2025,Cita del director sobre el verdadero horror de la historia.,La ciencia sin ï¿½ï¿½tica es el verdadero monstruo. Del Toro lo entie,,51,9,59,10,69,12,del toro sobre la ciencia es la ambici n hu,"['toro', 'ciencia', 'ambici']",cita del director sobre el verdadero horror de la historia,"['cita', 'director', 'verdadero', 'horror', 'historia']",la ciencia sin tica es el verdadero monstruo del toro lo entie,"['ciencia', 'tica', 'verdadero', 'monstruo', 'toro', 'entie']",cita del director sobre el verdadero horror de la historia la ciencia sin tica es el verdadero monstruo del toro lo entie,1
25,Generacion Z,Mï¿½ï¿½xico: La generaciï¿½ï¿½n del cambi,CNN Espaï¿½ï,18/11/2025,Reportaje especial sobre el activismo juvenil en Latam.,"Gen Z estï¿½ï¿½ harta de promesas vacï¿½ï¿½as, es hora de",,41,5,55,8,57,10,m xico la generaci n del cambi,"['xico', 'generaci', 'cambi']",reportaje especial sobre el activismo juvenil en latam,"['reportaje', 'especial', 'activismo', 'juvenil', 'latam']",gen z est harta de promesas vac as es hora de,"['gen', 'est', 'harta', 'promesas', 'vac', 'hora']",reportaje especial sobre el activismo juvenil en latam gen z est harta de promesas vac as es hora de,2
26,Frankenstein,Critica: La obra que define la filmografï¿½ï¿½a de Del ,SensaCine,05/11/2025,Una reseï¿½ï¿½a que alaba la madurez narrativa y visual del direc,"Mi pelï¿½ï¿½cula favorita de GDT, pu",,55,9,65,11,36,6,critica la obra que define la filmograf a de del,"['critica', 'obra', 'define', 'filmograf']",una rese a que alaba la madurez narrativa y visual del direc,"['rese', 'alaba', 'madurez', 'narrativa', 'visual', 'direc']",mi pel cula favorita de gdt pu,"['pel', 'cula', 'favorita', 'gdt']",una rese a que alaba la madurez narrativa y visual del direc mi pel cula favorita de gdt pu,0
27,Generacion Z,Padres de familia expresan apoyo a la marcha de sus hijos,El Heraldo,16/11/2025,Adultos mayores se unen a las filas en solidaridad.,"No es solo la Gen Z, es una preocupaciï¿½ï¿½n nacio",,57,11,51,9,51,10,padres de familia expresan apoyo a la marcha de sus hijos,"['padres', 'familia', 'expresan', 'apoyo', 'marcha', 'hijos']",adultos mayores se unen a las filas en solidaridad,"['adultos', 'mayores', 'unen', 'filas', 'solidaridad']",no es solo la gen z es una preocupaci n nacio,"['solo', 'gen', 'preocupaci', 'nacio']",adultos mayores se unen a las filas en solidaridad no es solo la gen z es una preocupaci n nacio,0
28,Frankenstein,Anï¿½ï¿½lisis: ï¿½ï¿½Por quï¿½ï¿½ Frankenstein sigue siend,Vulture,12/11/2025,La historia toca temas de rechazo social y disidencia.,"La Gen Z se identifica mucho con el Monstruo, un marginado incomprendido.",,58,6,54,9,73,12,an lisis por qu frankenstein sigue siend,"['lisis', 'frankenstein', 'sigue', 'siend']",la historia toca temas de rechazo social y disidencia,"['historia', 'toca', 'temas', 'rechazo', 'social', 'disidencia']",la gen z se identifica mucho con el monstruo un marginado incomprendido,"['gen', 'identifica', 'monstruo', 'marginado', 'incomprendido']",la historia toca temas de rechazo social y disidencia la gen z se identifica mucho con el monstruo un marginado incomprendido,1
29,Generacion Z,Hashtags de protesta se vuelven *trending* mundial,Twitter News,15/11/2025,#MexicoDespierta y #GenZPorLaPaz lideran tendencias.,La protesta digital es la nueva plaza pï¿½ï¿½bl,,50,7,52,5,47,8,hashtags de protesta se vuelven trending mundial,"['hashtags', 'protesta', 'vuelven', 'trending', 'mundial']",#mexicodespierta y #genzporlapaz lideran tendencias,"['#mexicodespierta', '#genzporlapaz', 'lideran', 'tendencias']",la protesta digital es la nueva plaza p bl,"['protesta', 'digital', 'nueva', 'plaza']",#mexicodespierta y #genzporlapaz lideran tendencias la protesta digital es la nueva plaza p bl,0
30,Frankenstein,Efectos visuales minimalistas y el poder de la caracterizaciï¿½,FX Magazine,10/11/2025,El uso de maquillaje prï¿½ï¿½ctico sobre CGI es un acie,Gracias Del Toro por el maquillaje tradicional. Se siente mï¿½ï¿½s r,,63,9,55,10,68,11,efectos visuales minimalistas y el poder de la caracterizaci,"['efectos', 'visuales', 'minimalistas', 'poder', 'caracterizaci']",el uso de maquillaje pr ctico sobre cgi es un acie,"['uso', 'maquillaje', 'ctico', 'cgi', 'acie']",gracias del toro por el maquillaje tradicional se siente m s r,"['gracias', 'toro', 'maquillaje', 'tradicional']",el uso de maquillaje pr ctico sobre cgi es un acie gracias del toro por el maquillaje tradicional se siente m s r,0
31,Generacion Z,Policï¿½ï¿½a Cibernï¿½ï¿½tica investiga origen de desinfo,El Paï¿½,14/11/2025,Seï¿½ï¿½alan cuentas vinculadas a grupos de oposici,La narrativa de culpar al otro nunca cambia.,,57,6,51,7,44,8,polic a cibern tica investiga origen de desinfo,"['polic', 'cibern', 'tica', 'investiga', 'origen', 'desinfo']",se alan cuentas vinculadas a grupos de oposici,"['alan', 'cuentas', 'vinculadas', 'grupos', 'oposici']",la narrativa de culpar al otro nunca cambia,"['narrativa', 'culpar', 'nunca', 'cambia']",se alan cuentas vinculadas a grupos de oposici la narrativa de culpar al otro nunca cambia,3
32,Frankenstein,"Del Toro en entrevista: ""Es una carta de amor a Mary Shelley""",CinemaBlend,07/11/2025,El director discute la fidelidad al espï¿½ï¿½ritu del li,Se siente el respeto por la fuente original.,,61,12,56,9,44,8,del toro en entrevista es una carta de amor a mary shelley,"['toro', 'entrevista', 'carta', 'amor', 'mary', 'shelley']",el director discute la fidelidad al esp ritu del li,"['director', 'discute', 'fidelidad', 'esp', 'ritu']",se siente el respeto por la fuente original,"['respeto', 'fuente', 'original']",el director discute la fidelidad al esp ritu del li se siente el respeto por la fuente original,1
33,Generacion Z,Anï¿½ï¿½lisis: Las demandas econï¿½ï¿½micas de la Gener,Expansiï¿½,17/11/2025,Los jï¿½ï¿½venes exigen salarios dignos y acceso a la vivie,"No podemos pagar la renta, el problema no es solo polï¿½ï¿½t",,55,7,59,10,60,11,an lisis las demandas econ micas de la gener,"['lisis', 'demandas', 'econ', 'micas', 'gener']",los j venes exigen salarios dignos y acceso a la vivie,"['venes', 'exigen', 'salarios', 'dignos', 'acceso', 'vivie']",no podemos pagar la renta el problema no es solo pol t,"['podemos', 'pagar', 'renta', 'problema', 'solo', 'pol']",los j venes exigen salarios dignos y acceso a la vivie no podemos pagar la renta el problema no es solo pol t,0
34,Frankenstein,Los 5 momentos mï¿½ï¿½s emotivos de Frankenstein (Spoiler F,BuzzFeed,09/11/2025,Lista de escenas destacadas por su carga dramï¿½ï¿½t,El momento del espejo es devastador.,,59,9,52,8,36,6,los 5 momentos m s emotivos de frankenstein spoiler f,"['momentos', 'emotivos', 'frankenstein', 'spoiler']",lista de escenas destacadas por su carga dram t,"['lista', 'escenas', 'destacadas', 'carga', 'dram']",el momento del espejo es devastador,"['momento', 'espejo', 'devastador']",lista de escenas destacadas por su carga dram t el momento del espejo es devastador,0
35,Generacion Z,Mï¿½ï¿½xico D.F.: Centro de la protesta juv,Reuters,16/11/2025,Cientos se congregan en el ï¿½ï¿½ngel de la Independen,"El ï¿½ï¿½ngel es nuestro punto de reuniï¿½ï¿½n, el sï¿½ï¿½mbolo de ",,43,7,54,9,67,10,m xico d f centro de la protesta juv,"['xico', 'centro', 'protesta', 'juv']",cientos se congregan en el ngel de la independen,"['cientos', 'congregan', 'ngel', 'independen']",el ngel es nuestro punto de reuni n el s mbolo de,"['ngel', 'punto', 'reuni', 'mbolo']",cientos se congregan en el ngel de la independen el ngel es nuestro punto de reuni n el s mbolo de,0
36,Frankenstein,ýýHabrýý secuela? GDT responde,Collider,14/11/2025,Del Toro dice que esta es una historia autocontenida.,"Perfecto, no necesita secuela. Es completa asï¿½",,30,4,53,9,48,7,habr secuela gdt responde,"['habr', 'secuela', 'gdt', 'responde']",del toro dice que esta es una historia autocontenida,"['toro', 'dice', 'historia', 'autocontenida']",perfecto no necesita secuela es completa as,"['perfecto', 'necesita', 'secuela', 'completa']",del toro dice que esta es una historia autocontenida perfecto no necesita secuela es completa as,1
37,Generacion Z,Uso de tecnologï¿½ï¿½a para evitar represiï¿½ï¿½n ,VICE News,15/11/2025,Apps de mensajerï¿½ï¿½a cifrada y transmisiï¿½ï¿½n en vivo para documentar,Hay que estar protegidos. Documentar es protegernos.,,50,6,74,10,52,7,uso de tecnolog a para evitar represi n,"['uso', 'tecnolog', 'evitar', 'represi']",apps de mensajer a cifrada y transmisi n en vivo para documentar,"['apps', 'mensajer', 'cifrada', 'transmisi', 'vivo', 'documentar']",hay que estar protegidos documentar es protegernos,"['protegidos', 'documentar', 'protegernos']",apps de mensajer a cifrada y transmisi n en vivo para documentar hay que estar protegidos documentar es protegernos,1
