ID,Categoria,Titulo,Medio,Fecha,Resumen,Comentario_Reaccion,Unnamed: 7,Titulo_len_char,Titulo_len_words,Resumen_len_char,Resumen_len_words,Comentario_Reaccion_len_char,Comentario_Reaccion_len_words,Titulo_clean,Titulo_tokens,Resumen_clean,Resumen_tokens,Comentario_Reaccion_clean,Comentario_Reaccion_tokens,texto_combinado,tema_dominante
119,Generacion Z,ýýQuiýýn financia la movilizaciýýn digital de la Gen Z?,El Universal,13/11/2025,Investigaciï¿½ï¿½n sobre el origen de los hashtags vira,Nuestra ï¿½ï¿½nica moneda es la indignaci,,55,9,55,8,41,6,qui n financia la movilizaci n digital de la gen z,"['qui', 'financia', 'movilizaci', 'digital', 'gen']",investigaci n sobre el origen de los hashtags vira,"['investigaci', 'origen', 'hashtags', 'vira']",nuestra nica moneda es la indignaci,"['nica', 'moneda', 'indignaci']",investigaci n sobre el origen de los hashtags vira nuestra nica moneda es la indignaci,0
120,Frankenstein,La estï¿½ï¿½tica victoriana y el detalle de producc,Screen Rant,06/11/2025,Entrevista con la diseï¿½ï¿½adora de producciï¿½ï¿½n sobre el mundo de la pe,"Cada detalle te transporta a la ï¿½ï¿½poca, maestrï¿½ï¿½",,51,8,76,12,56,8,la est tica victoriana y el detalle de producc,"['est', 'tica', 'victoriana', 'detalle', 'producc']",entrevista con la dise adora de producci n sobre el mundo de la pe,"['entrevista', 'dise', 'adora', 'producci', 'mundo']",cada detalle te transporta a la poca maestr,"['cada', 'detalle', 'transporta', 'poca', 'maestr']",entrevista con la dise adora de producci n sobre el mundo de la pe cada detalle te transporta a la poca maestr,1
121,Generacion Z,Estudiantes se suman a las demandas de la marcha,La Jornada,15/11/2025,Facultades de la UNAM y el IPN emiten comunicados de apoyo.,Las universidades son el motor del cambio.,,48,9,59,11,42,7,estudiantes se suman a las demandas de la marcha,"['estudiantes', 'suman', 'demandas', 'marcha']",facultades de la unam y el ipn emiten comunicados de apoyo,"['facultades', 'unam', 'ipn', 'emiten', 'comunicados', 'apoyo']",las universidades son el motor del cambio,"['universidades', 'motor', 'cambio']",facultades de la unam y el ipn emiten comunicados de apoyo las universidades son el motor del cambio,3
122,Frankenstein,Trï¿½ï¿½iler rompe rï¿½ï¿½cord de vistas en,Forbes,01/10/2025,El avance de la pelï¿½ï¿½cula se vuelve viral en ho,"El trï¿½ï¿½iler no le hace justicia, la pelï¿½ï¿½cula es much",,43,6,51,10,61,10,tr iler rompe r cord de vistas en,"['iler', 'rompe', 'cord', 'vistas']",el avance de la pel cula se vuelve viral en ho,"['avance', 'pel', 'cula', 'vuelve', 'viral']",el tr iler no le hace justicia la pel cula es much,"['iler', 'hace', 'justicia', 'pel', 'cula', 'much']",el avance de la pel cula se vuelve viral en ho el tr iler no le hace justicia la pel cula es much,3
123,Generacion Z,Influencers denuncian intimidaciï¿½ï¿½n tras apoyar las prote,El Paï¿½,17/11/2025,Cuentas grandes reportan ataques coordinados y amenazas.,El precio de alzar la voz es alto.,,61,7,56,7,34,8,influencers denuncian intimidaci n tras apoyar las prote,"['influencers', 'denuncian', 'intimidaci', 'tras', 'apoyar', 'prote']",cuentas grandes reportan ataques coordinados y amenazas,"['cuentas', 'grandes', 'reportan', 'ataques', 'coordinados', 'amenazas']",el precio de alzar la voz es alto,"['precio', 'alzar', 'voz', 'alto']",cuentas grandes reportan ataques coordinados y amenazas el precio de alzar la voz es alto,2
124,Frankenstein,"Del Toro sobre la ciencia: ""Es la ambiciï¿½ï¿½n hu""",The Guardian,07/11/2025,Cita del director sobre el verdadero horror de la historia.,La arrogancia del Dr. es la verdadera tragedia.,,51,9,59,10,47,8,del toro sobre la ciencia es la ambici n hu,"['toro', 'ciencia', 'ambici']",cita del director sobre el verdadero horror de la historia,"['cita', 'director', 'verdadero', 'horror', 'historia']",la arrogancia del dr es la verdadera tragedia,"['arrogancia', 'verdadera', 'tragedia']",cita del director sobre el verdadero horror de la historia la arrogancia del dr es la verdadera tragedia,0
125,Generacion Z,Mï¿½ï¿½xico: La generaciï¿½ï¿½n del cambi,CNN Espaï¿½ï,18/11/2025,Reportaje especial sobre el activismo juvenil en Latam.,Gen Z estï¿½ï¿½ definiendo la polï¿½ï¿½tica en ,,41,5,55,8,47,7,m xico la generaci n del cambi,"['xico', 'generaci', 'cambi']",reportaje especial sobre el activismo juvenil en latam,"['reportaje', 'especial', 'activismo', 'juvenil', 'latam']",gen z est definiendo la pol tica en,"['gen', 'est', 'definiendo', 'pol', 'tica']",reportaje especial sobre el activismo juvenil en latam gen z est definiendo la pol tica en,2
126,Frankenstein,Critica: La obra que define la filmografï¿½ï¿½a de Del ,SensaCine,05/11/2025,Una reseï¿½ï¿½a que alaba la madurez narrativa y visual del direc,Una lecciï¿½ï¿½n de cï¿½ï¿½mo adaptar un c,,55,9,65,11,42,7,critica la obra que define la filmograf a de del,"['critica', 'obra', 'define', 'filmograf']",una rese a que alaba la madurez narrativa y visual del direc,"['rese', 'alaba', 'madurez', 'narrativa', 'visual', 'direc']",una lecci n de c mo adaptar un c,"['lecci', 'adaptar']",una rese a que alaba la madurez narrativa y visual del direc una lecci n de c mo adaptar un c,0
127,Generacion Z,Padres de familia expresan apoyo a la marcha de sus hijos,El Heraldo,16/11/2025,Adultos mayores se unen a las filas en solidaridad.,El apoyo de los padres es crucial para la moral.,,57,11,51,9,48,10,padres de familia expresan apoyo a la marcha de sus hijos,"['padres', 'familia', 'expresan', 'apoyo', 'marcha', 'hijos']",adultos mayores se unen a las filas en solidaridad,"['adultos', 'mayores', 'unen', 'filas', 'solidaridad']",el apoyo de los padres es crucial para la moral,"['apoyo', 'padres', 'crucial', 'moral']",adultos mayores se unen a las filas en solidaridad el apoyo de los padres es crucial para la moral,3
128,Frankenstein,Anï¿½ï¿½lisis: ï¿½ï¿½Por quï¿½ï¿½ Frankenstein sigue siend,Vulture,12/11/2025,La historia toca temas de rechazo social y disidencia.,Refleja la ansiedad de sentirse diferente y excluido.,,58,6,54,9,53,8,an lisis por qu frankenstein sigue siend,"['lisis', 'frankenstein', 'sigue', 'siend']",la historia toca temas de rechazo social y disidencia,"['historia', 'toca', 'temas', 'rechazo', 'social', 'disidencia']",refleja la ansiedad de sentirse diferente y excluido,"['refleja', 'ansiedad', 'sentirse', 'diferente', 'excluido']",la historia toca temas de rechazo social y disidencia refleja la ansiedad de sentirse diferente y excluido,0
129,Generacion Z,Hashtags de protesta se vuelven *trending* mundial,Twitter News,15/11/2025,#MexicoDespierta y #GenZPorLaPaz lideran tendencias.,La voz digital supera a la frontera.,,50,7,52,5,36,7,hashtags de protesta se vuelven trending mundial,"['hashtags', 'protesta', 'vuelven', 'trending', 'mundial']",#mexicodespierta y #genzporlapaz lideran tendencias,"['#mexicodespierta', '#genzporlapaz', 'lideran', 'tendencias']",la voz digital supera a la frontera,"['voz', 'digital', 'supera', 'frontera']",#mexicodespierta y #genzporlapaz lideran tendencias la voz digital supera a la frontera,1
130,Frankenstein,Efectos visuales minimalistas y el poder de la caracterizaciï¿½,FX Magazine,10/11/2025,El uso de maquillaje prï¿½ï¿½ctico sobre CGI es un acie,La textura de la piel del Monstruo es increï¿½ï¿½blemente reali,,63,9,55,10,63,10,efectos visuales minimalistas y el poder de la caracterizaci,"['efectos', 'visuales', 'minimalistas', 'poder', 'caracterizaci']",el uso de maquillaje pr ctico sobre cgi es un acie,"['uso', 'maquillaje', 'ctico', 'cgi', 'acie']",la textura de la piel del monstruo es incre blemente reali,"['textura', 'piel', 'monstruo', 'incre', 'blemente', 'reali']",el uso de maquillaje pr ctico sobre cgi es un acie la textura de la piel del monstruo es incre blemente reali,0
131,Generacion Z,Policï¿½ï¿½a Cibernï¿½ï¿½tica investiga origen de desinfo,El Paï¿½,14/11/2025,Seï¿½ï¿½alan cuentas vinculadas a grupos de oposici,Intentan deslegitimar el movimiento a toda costa.,,57,6,51,7,49,7,polic a cibern tica investiga origen de desinfo,"['polic', 'cibern', 'tica', 'investiga', 'origen', 'desinfo']",se alan cuentas vinculadas a grupos de oposici,"['alan', 'cuentas', 'vinculadas', 'grupos', 'oposici']",intentan deslegitimar el movimiento a toda costa,"['intentan', 'deslegitimar', 'movimiento', 'toda', 'costa']",se alan cuentas vinculadas a grupos de oposici intentan deslegitimar el movimiento a toda costa,3
132,Frankenstein,"Del Toro en entrevista: ""Es una carta de amor a Mary Shelley""",CinemaBlend,07/11/2025,El director discute la fidelidad al espï¿½ï¿½ritu del li,"Respeta la esencia, pero le aï¿½ï¿½ade su toque perso",,61,12,56,9,53,9,del toro en entrevista es una carta de amor a mary shelley,"['toro', 'entrevista', 'carta', 'amor', 'mary', 'shelley']",el director discute la fidelidad al esp ritu del li,"['director', 'discute', 'fidelidad', 'esp', 'ritu']",respeta la esencia pero le a ade su toque perso,"['respeta', 'esencia', 'ade', 'toque', 'perso']",el director discute la fidelidad al esp ritu del li respeta la esencia pero le a ade su toque perso,1
133,Generacion Z,Anï¿½ï¿½lisis: Las demandas econï¿½ï¿½micas de la Gener,Expansiï¿½,17/11/2025,Los jï¿½ï¿½venes exigen salarios dignos y acceso a la vivie,El futuro econï¿½ï¿½mico es la mayor preocupaciï¿½ï¿½n de l,,55,7,59,10,59,9,an lisis las demandas econ micas de la gener,"['lisis', 'demandas', 'econ', 'micas', 'gener']",los j venes exigen salarios dignos y acceso a la vivie,"['venes', 'exigen', 'salarios', 'dignos', 'acceso', 'vivie']",el futuro econ mico es la mayor preocupaci n de l,"['futuro', 'econ', 'mico', 'mayor', 'preocupaci']",los j venes exigen salarios dignos y acceso a la vivie el futuro econ mico es la mayor preocupaci n de l,0
134,Frankenstein,Los 5 momentos mï¿½ï¿½s emotivos de Frankenstein (Spoiler F,BuzzFeed,09/11/2025,Lista de escenas destacadas por su carga dramï¿½ï¿½t,La escena final me destrozï¿½ï¿½ el coraz,,59,9,52,8,41,7,los 5 momentos m s emotivos de frankenstein spoiler f,"['momentos', 'emotivos', 'frankenstein', 'spoiler']",lista de escenas destacadas por su carga dram t,"['lista', 'escenas', 'destacadas', 'carga', 'dram']",la escena final me destroz el coraz,"['escena', 'final', 'destroz', 'coraz']",lista de escenas destacadas por su carga dram t la escena final me destroz el coraz,2
135,Generacion Z,Mï¿½ï¿½xico D.F.: Centro de la protesta juv,Reuters,16/11/2025,Cientos se congregan en el ï¿½ï¿½ngel de la Independen,El ï¿½ï¿½ngel fue el punto de encuentro de la espera,,43,7,54,9,52,10,m xico d f centro de la protesta juv,"['xico', 'centro', 'protesta', 'juv']",cientos se congregan en el ngel de la independen,"['cientos', 'congregan', 'ngel', 'independen']",el ngel fue el punto de encuentro de la espera,"['ngel', 'punto', 'encuentro', 'espera']",cientos se congregan en el ngel de la independen el ngel fue el punto de encuentro de la espera,0
136,Frankenstein,ýýHabrýý secuela? GDT responde,Collider,14/11/2025,Del Toro dice que esta es una historia autocontenida.,"Terminï¿½ï¿½ perfectamente, no necesita m",,30,4,53,9,41,5,habr secuela gdt responde,"['habr', 'secuela', 'gdt', 'responde']",del toro dice que esta es una historia autocontenida,"['toro', 'dice', 'historia', 'autocontenida']",termin perfectamente no necesita m,"['termin', 'perfectamente', 'necesita']",del toro dice que esta es una historia autocontenida termin perfectamente no necesita m,0
137,Generacion Z,Uso de tecnologï¿½ï¿½a para evitar represiï¿½ï¿½n ,VICE News,15/11/2025,Apps de mensajerï¿½ï¿½a cifrada y transmisiï¿½ï¿½n en vivo para documentar,El celular es nuestra arma de defensa y denuncia.,,50,6,74,10,49,9,uso de tecnolog a para evitar represi n,"['uso', 'tecnolog', 'evitar', 'represi']",apps de mensajer a cifrada y transmisi n en vivo para documentar,"['apps', 'mensajer', 'cifrada', 'transmisi', 'vivo', 'documentar']",el celular es nuestra arma de defensa y denuncia,"['celular', 'arma', 'defensa', 'denuncia']",apps de mensajer a cifrada y transmisi n en vivo para documentar el celular es nuestra arma de defensa y denuncia,3
138,Frankenstein,El papel del color y la luz en la pelï¿½ï¿½,FilmeNow,06/11/2025,Anï¿½ï¿½lisis visual del director de fotograf,La niebla y la oscuridad son personajes en sï¿½ï¿½ mis,,43,10,45,6,54,10,el papel del color y la luz en la pel,"['papel', 'color', 'luz', 'pel']",an lisis visual del director de fotograf,"['lisis', 'visual', 'director', 'fotograf']",la niebla y la oscuridad son personajes en s mis,"['niebla', 'oscuridad', 'personajes']",an lisis visual del director de fotograf la niebla y la oscuridad son personajes en s mis,3
139,Generacion Z,Gobierno acusa vandalismo en monumentos histï¿½ï¿½r,INAH,17/11/2025,Daï¿½ï¿½os en edificios y estatuas tras los enfrentamien,El daï¿½ï¿½o al patrimonio es lamenta,,51,6,56,8,37,6,gobierno acusa vandalismo en monumentos hist r,"['gobierno', 'acusa', 'vandalismo', 'monumentos', 'hist']",da os en edificios y estatuas tras los enfrentamien,"['edificios', 'estatuas', 'tras', 'enfrentamien']",el da o al patrimonio es lamenta,"['patrimonio', 'lamenta']",da os en edificios y estatuas tras los enfrentamien el da o al patrimonio es lamenta,0
140,Frankenstein,Estreno de Frankenstein genera debate en Reddit,Reddit r/movies,08/11/2025,Discusiï¿½ï¿½n sobre la adaptaciï¿½ï¿½n y la controversia del ,"El debate en Reddit estï¿½ï¿½ encendido, es un signo de ï¿½",,47,7,62,8,59,11,estreno de frankenstein genera debate en reddit,"['estreno', 'frankenstein', 'genera', 'debate', 'reddit']",discusi n sobre la adaptaci n y la controversia del,"['discusi', 'adaptaci', 'controversia']",el debate en reddit est encendido es un signo de,"['debate', 'reddit', 'est', 'encendido', 'signo']",discusi n sobre la adaptaci n y la controversia del el debate en reddit est encendido es un signo de,0
141,Generacion Z,Movilizaciï¿½ï¿½n: ï¿½ï¿½Una ola organizada o espo,El Paï¿½,18/11/2025,Expertos debaten la naturaleza del movimiento juvenil.,Es una ola de indignaciï¿½ï¿½n genu,,50,6,54,7,35,6,movilizaci n una ola organizada o espo,"['movilizaci', 'ola', 'organizada', 'espo']",expertos debaten la naturaleza del movimiento juvenil,"['expertos', 'debaten', 'naturaleza', 'movimiento', 'juvenil']",es una ola de indignaci n genu,"['ola', 'indignaci', 'genu']",expertos debaten la naturaleza del movimiento juvenil es una ola de indignaci n genu,1
142,Frankenstein,"Actores describen el proceso de maquillaje como ""tortuoso""",The Hollywood Reporter,11/11/2025,Horas de trabajo diario para lograr la apariencia del Monstruo.,"El sacrificio se ve en la pantalla, un trabajo artesanal.",,58,8,63,10,57,10,actores describen el proceso de maquillaje como tortuoso,"['actores', 'describen', 'proceso', 'maquillaje', 'tortuoso']",horas de trabajo diario para lograr la apariencia del monstruo,"['horas', 'trabajo', 'diario', 'lograr', 'apariencia', 'monstruo']",el sacrificio se ve en la pantalla un trabajo artesanal,"['sacrificio', 'pantalla', 'trabajo', 'artesanal']",horas de trabajo diario para lograr la apariencia del monstruo el sacrificio se ve en la pantalla un trabajo artesanal,0
143,Generacion Z,Anï¿½ï¿½lisis de lenguaje visual de la prot,Diseï¿½ï¿½,15/11/2025,Uso de carteles minimalistas y referencias a memes.,Los carteles eran arte puro de protesta.,,43,7,51,8,40,7,an lisis de lenguaje visual de la prot,"['lisis', 'lenguaje', 'visual', 'prot']",uso de carteles minimalistas y referencias a memes,"['uso', 'carteles', 'minimalistas', 'referencias', 'memes']",los carteles eran arte puro de protesta,"['carteles', 'arte', 'puro', 'protesta']",uso de carteles minimalistas y referencias a memes los carteles eran arte puro de protesta,3
144,Frankenstein,La mï¿½ï¿½sica de [Compositor] eleva la emoc,Soundtrack World,05/11/2025,Reseï¿½ï¿½a de la banda sonora de la pelï¿½,La banda sonora es tan ï¿½ï¿½pica como la histo,,44,7,43,8,47,9,la m sica de compositor eleva la emoc,"['sica', 'compositor', 'eleva', 'emoc']",rese a de la banda sonora de la pel,"['rese', 'banda', 'sonora', 'pel']",la banda sonora es tan pica como la histo,"['banda', 'sonora', 'tan', 'pica', 'histo']",rese a de la banda sonora de la pel la banda sonora es tan pica como la histo,0
145,Generacion Z,Jï¿½ï¿½venes convocan a una segunda marcha en dicie,Redes Sociales,17/11/2025,La convocatoria es para el dï¿½ï¿½a 10 de diciem,"La lucha no termina, apenas comienza.",,51,8,48,9,37,6,j venes convocan a una segunda marcha en dicie,"['venes', 'convocan', 'segunda', 'marcha', 'dicie']",la convocatoria es para el d a 10 de diciem,"['convocatoria', 'diciem']",la lucha no termina apenas comienza,"['lucha', 'termina', 'apenas', 'comienza']",la convocatoria es para el d a 10 de diciem la lucha no termina apenas comienza,1
146,Frankenstein,Comparativa: ï¿½ï¿½Mejor que las versiones clï¿½ï,Den of Geek,07/11/2025,El artï¿½ï¿½culo compara la nueva versiï¿½ï¿½n con las de la Un,Es la versiï¿½ï¿½n que Mary Shelley merecï¿½ï,,49,6,63,11,45,7,comparativa mejor que las versiones cl,"['comparativa', 'mejor', 'versiones']",el art culo compara la nueva versi n con las de la un,"['art', 'culo', 'compara', 'nueva', 'versi']",es la versi n que mary shelley merec,"['versi', 'mary', 'shelley', 'merec']",el art culo compara la nueva versi n con las de la un es la versi n que mary shelley merec,0
147,Generacion Z,Marcha: Un grito contra la corrupciï¿½ï¿½n y la impun,W Radio,16/11/2025,Las demandas centrales giran en torno a la justicia.,La justicia es la base de todo lo que pedimos.,,53,9,52,9,46,10,marcha un grito contra la corrupci n y la impun,"['marcha', 'grito', 'corrupci', 'impun']",las demandas centrales giran en torno a la justicia,"['demandas', 'centrales', 'giran', 'torno', 'justicia']",la justicia es la base de todo lo que pedimos,"['justicia', 'base', 'pedimos']",las demandas centrales giran en torno a la justicia la justicia es la base de todo lo que pedimos,0
148,Frankenstein,"Del Toro sobre la ciencia: ""Es la ambiciï¿½ï¿½n hu""",Entrevista Televisa,04/11/2025,El director explica su enfoque psicolï¿½ï¿½gico del person,La ambiciï¿½ï¿½n desmedida es el verdadero motor del ter,,51,9,58,8,56,9,del toro sobre la ciencia es la ambici n hu,"['toro', 'ciencia', 'ambici']",el director explica su enfoque psicol gico del person,"['director', 'explica', 'enfoque', 'psicol', 'gico', 'person']",la ambici n desmedida es el verdadero motor del ter,"['ambici', 'desmedida', 'verdadero', 'motor', 'ter']",el director explica su enfoque psicol gico del person la ambici n desmedida es el verdadero motor del ter,1
149,Generacion Z,Testimonios: Jï¿½ï¿½venes que fueron por primera vez a mar,Aristegui Noticias,18/11/2025,Historias de la experiencia inicial en las protestas.,"Fue mi primera vez, y no serï¿½ï¿½ la ï¿½ï",,58,9,53,8,42,9,testimonios j venes que fueron por primera vez a mar,"['testimonios', 'venes', 'primera', 'vez', 'mar']",historias de la experiencia inicial en las protestas,"['historias', 'experiencia', 'inicial', 'protestas']",fue mi primera vez y no ser la,"['primera', 'vez', 'ser']",historias de la experiencia inicial en las protestas fue mi primera vez y no ser la,0
150,Frankenstein,ýýxito de taquilla limitada en cines independientes,Box Office Guru,13/11/2025,La pelï¿½ï¿½cula tuvo buenas cifras antes de pasar a stream,Un ï¿½ï¿½xito de nicho que se masificï¿½ï¿½ en st,,51,7,59,10,49,9,xito de taquilla limitada en cines independientes,"['xito', 'taquilla', 'limitada', 'cines', 'independientes']",la pel cula tuvo buenas cifras antes de pasar a stream,"['pel', 'cula', 'buenas', 'cifras', 'pasar', 'stream']",un xito de nicho que se masific en st,"['xito', 'nicho', 'masific']",la pel cula tuvo buenas cifras antes de pasar a stream un xito de nicho que se masific en st,3
151,Generacion Z,Movilizaciï¿½ï¿½n en Guadalajara y Monte,El Norte,16/11/2025,Las protestas se replican en otros estados clave.,La provincia tambiï¿½ï¿½n alza la ,,40,5,49,8,34,5,movilizaci n en guadalajara y monte,"['movilizaci', 'guadalajara', 'monte']",las protestas se replican en otros estados clave,"['protestas', 'replican', 'clave']",la provincia tambi n alza la,"['provincia', 'tambi', 'alza']",las protestas se replican en otros estados clave la provincia tambi n alza la,1
152,Frankenstein,Del Toro explica el final alternativo,Revista Empire,15/11/2025,Detalles sobre las escenas eliminadas y cambios de guion.,El final elegido es el mï¿½ï¿½s coherente con el tono de ,,37,6,57,9,57,11,del toro explica el final alternativo,"['toro', 'explica', 'final', 'alternativo']",detalles sobre las escenas eliminadas y cambios de guion,"['detalles', 'escenas', 'eliminadas', 'cambios', 'guion']",el final elegido es el m s coherente con el tono de,"['final', 'elegido', 'coherente', 'tono']",detalles sobre las escenas eliminadas y cambios de guion el final elegido es el m s coherente con el tono de,2
153,Generacion Z,Debate en Twitter: ï¿½ï¿½Falta de liderazgo en la Ge,El Universal,17/11/2025,Algunos critican la falta de una figura central en el movimiento.,El liderazgo es horizontal en esta generaciï¿½ï,,52,9,65,11,47,7,debate en twitter falta de liderazgo en la ge,"['debate', 'twitter', 'falta', 'liderazgo']",algunos critican la falta de una figura central en el movimiento,"['critican', 'falta', 'figura', 'central', 'movimiento']",el liderazgo es horizontal en esta generaci,"['liderazgo', 'horizontal', 'generaci']",algunos critican la falta de una figura central en el movimiento el liderazgo es horizontal en esta generaci,2
154,Frankenstein,Anï¿½ï¿½lisis del vestuario como herramienta narra,Vogue Mï¿½ï¿½,08/11/2025,La ropa refleja el estatus y la decadencia moral.,El vestuario es un personaje mï¿½ï¿½s en la histo,,50,6,49,9,49,9,an lisis del vestuario como herramienta narra,"['lisis', 'vestuario', 'herramienta', 'narra']",la ropa refleja el estatus y la decadencia moral,"['ropa', 'refleja', 'estatus', 'decadencia', 'moral']",el vestuario es un personaje m s en la histo,"['vestuario', 'personaje', 'histo']",la ropa refleja el estatus y la decadencia moral el vestuario es un personaje m s en la histo,3
155,Generacion Z,Reporte: Uso de VPN y Tor para comunicaciï¿½ï¿½n se,TechCrunch,15/11/2025,La Gen Z utiliza herramientas digitales para evadir vigilancia.,La protesta se organiza en la sombra digital.,,51,9,63,9,45,8,reporte uso de vpn y tor para comunicaci n se,"['reporte', 'uso', 'vpn', 'tor', 'comunicaci']",la gen z utiliza herramientas digitales para evadir vigilancia,"['gen', 'utiliza', 'herramientas', 'digitales', 'evadir', 'vigilancia']",la protesta se organiza en la sombra digital,"['protesta', 'organiza', 'sombra', 'digital']",la gen z utiliza herramientas digitales para evadir vigilancia la protesta se organiza en la sombra digital,1
156,Frankenstein,Netflix compra los derechos globales por una cifra millonaria,Deadline,25/10/2025,El acuerdo garantiza una distribuciï¿½ï¿½n mas,"Gracias a Netflix, la obra llegï¿½ï¿½ a todo el mu",,61,9,46,6,50,10,netflix compra los derechos globales por una cifra millonaria,"['netflix', 'compra', 'derechos', 'globales', 'cifra', 'millonaria']",el acuerdo garantiza una distribuci n mas,"['acuerdo', 'garantiza', 'distribuci', 'mas']",gracias a netflix la obra lleg a todo el mu,"['gracias', 'netflix', 'obra', 'lleg']",el acuerdo garantiza una distribuci n mas gracias a netflix la obra lleg a todo el mu,2
157,Generacion Z,El lenguaje inclusivo y la Gen Z en la protesta,Cultura Colectiva,16/11/2025,Anï¿½ï¿½lisis del vocabulario utilizado en las consig,La Gen Z trae consigo el lenguaje de la inclusiï¿½ï,,47,10,53,7,51,10,el lenguaje inclusivo y la gen z en la protesta,"['lenguaje', 'inclusivo', 'gen', 'protesta']",an lisis del vocabulario utilizado en las consig,"['lisis', 'vocabulario', 'utilizado', 'consig']",la gen z trae consigo el lenguaje de la inclusi,"['gen', 'trae', 'consigo', 'lenguaje', 'inclusi']",an lisis del vocabulario utilizado en las consig la gen z trae consigo el lenguaje de la inclusi,3
158,Frankenstein,"Del Toro sobre el CGI: ""Solo donde sea estrictamente necesario""",Video Production,06/11/2025,ýýnfasis en los efectos prýýcticos y la artesanýýa.,Se agradece el toque prï¿½ï¿½ctico y menos digi,,63,10,51,8,47,8,del toro sobre el cgi solo donde sea estrictamente necesario,"['toro', 'cgi', 'solo', 'estrictamente', 'necesario']",nfasis en los efectos pr cticos y la artesan a,"['nfasis', 'efectos', 'cticos', 'artesan']",se agradece el toque pr ctico y menos digi,"['agradece', 'toque', 'ctico', 'menos', 'digi']",nfasis en los efectos pr cticos y la artesan a se agradece el toque pr ctico y menos digi,0
159,Generacion Z,Gobierno acusa a partidos de derecha de infiltrar la marcha,Milenio,14/11/2025,Argumentan que buscan desestabilizar la administraciï¿½ï,Una cortina de humo para no hablar de las demandas.,,59,10,56,6,51,10,gobierno acusa a partidos de derecha de infiltrar la marcha,"['gobierno', 'acusa', 'partidos', 'derecha', 'infiltrar', 'marcha']",argumentan que buscan desestabilizar la administraci,"['argumentan', 'buscan', 'desestabilizar', 'administraci']",una cortina de humo para no hablar de las demandas,"['cortina', 'humo', 'hablar', 'demandas']",argumentan que buscan desestabilizar la administraci una cortina de humo para no hablar de las demandas,0
