ID,Categoria,Titulo,Medio,Fecha,Resumen,Comentario_Reaccion,
118,Frankenstein,Frankenstein: ï¿½ï¿½La obra maestra mï¿½ï¿½s oscura,IndieWire,10/11/2025,Comparaciï¿½ï¿½n con El Laberinto del Fauno y La Forma del A,"La mï¿½ï¿½s cruda y menos fantï¿½ï¿½stica, u",
119,Generacion Z,ýýQuiýýn financia la movilizaciýýn digital de la Gen Z?,El Universal,13/11/2025,Investigaciï¿½ï¿½n sobre el origen de los hashtags vira,Nuestra ï¿½ï¿½nica moneda es la indignaci,
120,Frankenstein,La estï¿½ï¿½tica victoriana y el detalle de producc,Screen Rant,06/11/2025,Entrevista con la diseï¿½ï¿½adora de producciï¿½ï¿½n sobre el mundo de la pe,"Cada detalle te transporta a la ï¿½ï¿½poca, maestrï¿½ï¿½",
121,Generacion Z,Estudiantes se suman a las demandas de la marcha,La Jornada,15/11/2025,Facultades de la UNAM y el IPN emiten comunicados de apoyo.,Las universidades son el motor del cambio.,
122,Frankenstein,Trï¿½ï¿½iler rompe rï¿½ï¿½cord de vistas en,Forbes,01/10/2025,El avance de la pelï¿½ï¿½cula se vuelve viral en ho,"El trï¿½ï¿½iler no le hace justicia, la pelï¿½ï¿½cula es much",
123,Generacion Z,Influencers denuncian intimidaciï¿½ï¿½n tras apoyar las prote,El Paï¿½,17/11/2025,Cuentas grandes reportan ataques coordinados y amenazas.,El precio de alzar la voz es alto.,
124,Frankenstein,"Del Toro sobre la ciencia: ""Es la ambiciï¿½ï¿½n hu""",The Guardian,07/11/2025,Cita del director sobre el verdadero horror de la historia.,La arrogancia del Dr. es la verdadera tragedia.,
125,Generacion Z,Mï¿½ï¿½xico: La generaciï¿½ï¿½n del cambi,CNN Espaï¿½ï,18/11/2025,Reportaje especial sobre el activismo juvenil en Latam.,Gen Z estï¿½ï¿½ definiendo la polï¿½ï¿½tica en ,
126,Frankenstein,Critica: La obra que define la filmografï¿½ï¿½a de Del ,SensaCine,05/11/2025,Una reseï¿½ï¿½a que alaba la madurez narrativa y visual del direc,Una lecciï¿½ï¿½n de cï¿½ï¿½mo adaptar un c,
127,Generacion Z,Padres de familia expresan apoyo a la marcha de sus hijos,El Heraldo,16/11/2025,Adultos mayores se unen a las filas en solidaridad.,El apoyo de los padres es crucial para la moral.,
128,Frankenstein,Anï¿½ï¿½lisis: ï¿½ï¿½Por quï¿½ï¿½ Frankenstein sigue siend,Vulture,12/11/2025,La historia toca temas de rechazo social y disidencia.,Refleja la ansiedad de sentirse diferente y excluido.,
129,Generacion Z,Hashtags de protesta se vuelven *trending* mundial,Twitter News,15/11/2025,#MexicoDespierta y #GenZPorLaPaz lideran tendencias.,La voz digital supera a la frontera.,
130,Frankenstein,Efectos visuales minimalistas y el poder de la caracterizaciï¿½,FX Magazine,10/11/2025,El uso de maquillaje prï¿½ï¿½ctico sobre CGI es un acie,La textura de la piel del Monstruo es increï¿½ï¿½blemente reali,
131,Generacion Z,Policï¿½ï¿½a Cibernï¿½ï¿½tica investiga origen de desinfo,El Paï¿½,14/11/2025,Seï¿½ï¿½alan cuentas vinculadas a grupos de oposici,Intentan deslegitimar el movimiento a toda costa.,
132,Frankenstein,"Del Toro en entrevista: ""Es una carta de amor a Mary Shelley""",CinemaBlend,07/11/2025,El director discute la fidelidad al espï¿½ï¿½ritu del li,"Respeta la esencia, pero le aï¿½ï¿½ade su toque perso",
133,Generacion Z,Anï¿½ï¿½lisis: Las demandas econï¿½ï¿½micas de la Gener,Expansiï¿½,17/11/2025,Los jï¿½ï¿½venes exigen salarios dignos y acceso a la vivie,El futuro econï¿½ï¿½mico es la mayor preocupaciï¿½ï¿½n de l,
134,Frankenstein,Los 5 momentos mï¿½ï¿½s emotivos de Frankenstein (Spoiler F,BuzzFeed,09/11/2025,Lista de escenas destacadas por su carga dramï¿½ï¿½t,La escena final me destrozï¿½ï¿½ el coraz,
135,Generacion Z,Mï¿½ï¿½xico D.F.: Centro de la protesta juv,Reuters,16/11/2025,Cientos se congregan en el ï¿½ï¿½ngel de la Independen,El ï¿½ï¿½ngel fue el punto de encuentro de la espera,
136,Frankenstein,ýýHabrýý secuela? GDT responde,Collider,14/11/2025,Del Toro dice que esta es una historia autocontenida.,"Terminï¿½ï¿½ perfectamente, no necesita m",
137,Generacion Z,Uso de tecnologï¿½ï¿½a para evitar represiï¿½ï¿½n ,VICE News,15/11/2025,Apps de mensajerï¿½ï¿½a cifrada y transmisiï¿½ï¿½n en vivo para documentar,El celular es nuestra arma de defensa y denuncia.,
138,Frankenstein,El papel del color y la luz en la pelï¿½ï¿½,FilmeNow,06/11/2025,Anï¿½ï¿½lisis visual del director de fotograf,La niebla y la oscuridad son personajes en sï¿½ï¿½ mis,
139,Generacion Z,Gobierno acusa vandalismo en monumentos histï¿½ï¿½r,INAH,17/11/2025,Daï¿½ï¿½os en edificios y estatuas tras los enfrentamien,El daï¿½ï¿½o al patrimonio es lamenta,
140,Frankenstein,Estreno de Frankenstein genera debate en Reddit,Reddit r/movies,08/11/2025,Discusiï¿½ï¿½n sobre la adaptaciï¿½ï¿½n y la controversia del ,"El debate en Reddit estï¿½ï¿½ encendido, es un signo de ï¿½",
141,Generacion Z,Movilizaciï¿½ï¿½n: ï¿½ï¿½Una ola organizada o espo,El Paï¿½,18/11/2025,Expertos debaten la naturaleza del movimiento juvenil.,Es una ola de indignaciï¿½ï¿½n genu,
142,Frankenstein,"Actores describen el proceso de maquillaje como ""tortuoso""",The Hollywood Reporter,11/11/2025,Horas de trabajo diario para lograr la apariencia del Monstruo.,"El sacrificio se ve en la pantalla, un trabajo artesanal.",
143,Generacion Z,Anï¿½ï¿½lisis de lenguaje visual de la prot,Diseï¿½ï¿½,15/11/2025,Uso de carteles minimalistas y referencias a memes.,Los carteles eran arte puro de protesta.,
144,Frankenstein,La mï¿½ï¿½sica de [Compositor] eleva la emoc,Soundtrack World,05/11/2025,Reseï¿½ï¿½a de la banda sonora de la pelï¿½,La banda sonora es tan ï¿½ï¿½pica como la histo,
145,Generacion Z,Jï¿½ï¿½venes convocan a una segunda marcha en dicie,Redes Sociales,17/11/2025,La convocatoria es para el dï¿½ï¿½a 10 de diciem,"La lucha no termina, apenas comienza.",
146,Frankenstein,Comparativa: ï¿½ï¿½Mejor que las versiones clï¿½ï,Den of Geek,07/11/2025,El artï¿½ï¿½culo compara la nueva versiï¿½ï¿½n con las de la Un,Es la versiï¿½ï¿½n que Mary Shelley merecï¿½ï,
147,Generacion Z,Marcha: Un grito contra la corrupciï¿½ï¿½n y la impun,W Radio,16/11/2025,Las demandas centrales giran en torno a la justicia.,La justicia es la base de todo lo que pedimos.,
148,Frankenstein,"Del Toro sobre la ciencia: ""Es la ambiciï¿½ï¿½n hu""",Entrevista Televisa,04/11/2025,El director explica su enfoque psicolï¿½ï¿½gico del person,La ambiciï¿½ï¿½n desmedida es el verdadero motor del ter,
149,Generacion Z,Testimonios: Jï¿½ï¿½venes que fueron por primera vez a mar,Aristegui Noticias,18/11/2025,Historias de la experiencia inicial en las protestas.,"Fue mi primera vez, y no serï¿½ï¿½ la ï¿½ï",
150,Frankenstein,ýýxito de taquilla limitada en cines independientes,Box Office Guru,13/11/2025,La pelï¿½ï¿½cula tuvo buenas cifras antes de pasar a stream,Un ï¿½ï¿½xito de nicho que se masificï¿½ï¿½ en st,
151,Generacion Z,Movilizaciï¿½ï¿½n en Guadalajara y Monte,El Norte,16/11/2025,Las protestas se replican en otros estados clave.,La provincia tambiï¿½ï¿½n alza la ,
152,Frankenstein,Del Toro explica el final alternativo,Revista Empire,15/11/2025,Detalles sobre las escenas eliminadas y cambios de guion.,El final elegido es el mï¿½ï¿½s coherente con el tono de ,
153,Generacion Z,Debate en Twitter: ï¿½ï¿½Falta de liderazgo en la Ge,El Universal,17/11/2025,Algunos critican la falta de una figura central en el movimiento.,El liderazgo es horizontal en esta generaciï¿½ï,
154,Frankenstein,Anï¿½ï¿½lisis del vestuario como herramienta narra,Vogue Mï¿½ï¿½,08/11/2025,La ropa refleja el estatus y la decadencia moral.,El vestuario es un personaje mï¿½ï¿½s en la histo,
155,Generacion Z,Reporte: Uso de VPN y Tor para comunicaciï¿½ï¿½n se,TechCrunch,15/11/2025,La Gen Z utiliza herramientas digitales para evadir vigilancia.,La protesta se organiza en la sombra digital.,
156,Frankenstein,Netflix compra los derechos globales por una cifra millonaria,Deadline,25/10/2025,El acuerdo garantiza una distribuciï¿½ï¿½n mas,"Gracias a Netflix, la obra llegï¿½ï¿½ a todo el mu",
157,Generacion Z,El lenguaje inclusivo y la Gen Z en la protesta,Cultura Colectiva,16/11/2025,Anï¿½ï¿½lisis del vocabulario utilizado en las consig,La Gen Z trae consigo el lenguaje de la inclusiï¿½ï,
158,Frankenstein,"Del Toro sobre el CGI: ""Solo donde sea estrictamente necesario""",Video Production,06/11/2025,ýýnfasis en los efectos prýýcticos y la artesanýýa.,Se agradece el toque prï¿½ï¿½ctico y menos digi,
159,Generacion Z,Gobierno acusa a partidos de derecha de infiltrar la marcha,Milenio,14/11/2025,Argumentan que buscan desestabilizar la administraciï¿½ï,Una cortina de humo para no hablar de las demandas.,
160,Frankenstein,Frankenstein: El monstruo que nos obliga a vernos,Psicologï¿½ï¿½a y ,11/11/2025,Anï¿½ï¿½lisis psicolï¿½ï¿½gico de la relaciï¿½ï¿½n cread,El Monstruo es el espejo de nuestra sociedad.,
161,Generacion Z,Gen Z crea su propia narrativa en YouTube,YouTube Trends,16/11/2025,Canales de jï¿½ï¿½venes documentan la marcha sin filt,La informaciï¿½ï¿½n real viene de los jï¿½ï¿½venes en e,
162,Frankenstein,La iluminaciï¿½ï¿½n como personaje en el film de Del ,Cinephilia,09/11/2025,Estudio de cï¿½ï¿½mo el claroscuro define el tono de la pelï¿½,Un maestro del contraste y la sombra.,
163,Generacion Z,Anï¿½ï¿½lisis: Diferencias con el movimiento estudiantil de,History Channel,18/11/2025,Comparativa entre el activismo actual y el pasado.,La tecnologï¿½ï¿½a es la mayor diferencia con el,
164,Frankenstein,La visiï¿½ï¿½n del Dr. Frankenstein como un niï¿½ï¿½o ca,The New Yorker,12/11/2025,Crï¿½ï¿½tica que examina la inmadurez moral del cientï¿½,Un genio con la madurez de un niï¿½ï,
165,Generacion Z,Reporte de Derechos Humanos condena uso excesivo de la fuerza,Amnistï¿½ï¿½a Internaci,17/11/2025,Documentan agresiones a manifestantes pacï¿½ï¿½fi,El derecho a protestar debe ser respetado.,
166,Frankenstein,Guillermo del Toro anuncia un libro de arte de la pelï¿½ï¿½,Dark Horse Comics,14/11/2025,El tomo contendrï¿½ï¿½ bocetos y diseï¿½ï¿½os conce,El arte conceptual es tan bueno como la pelï¿½ï¿½c,
167,Generacion Z,Economistas advierten sobre el impacto de la inestabilidad social,Financial Times,18/11/2025,Las protestas pueden afectar la inversiï¿½ï¿½n extranj,La inestabilidad es consecuencia de la crisis social.,
168,Frankenstein,Frankenstein y el cine gï¿½ï¿½tico: Un regreso a las raï,Horror Freak,05/11/2025,La pelï¿½ï¿½cula abraza la tradiciï¿½ï¿½n del horror c,Un festï¿½ï¿½n visual para los amantes del gï¿½,
169,Generacion Z,Manifestantes utilizan drones para documentar la marcha,Tecnologï¿½ï¿½a para el Ca,16/11/2025,Cï¿½ï¿½maras aï¿½ï¿½reas registran la magnitud de la concent,Los drones ofrecen una perspectiva imparcial.,
170,Frankenstein,"Del Toro agradece el recibimiento: ""Una obra personal""",Discurso de Premiere,30/10/2025,El director se emociona al hablar de su conexiï¿½ï¿½n con la histo,La pasiï¿½ï¿½n de GDT se transmite en el c,
171,Generacion Z,Comentarios: La marcha dividiï¿½ï¿½ a las fami,Foros de Debate,17/11/2025,Generaciones mayores critican la falta de respeto a la autoridad.,La brecha generacional se hizo mï¿½ï¿½s grande en la mar,
172,Frankenstein,El Monstruo de Del Toro: ï¿½ï¿½El mï¿½ï¿½s vulnerable d,Film Comment,10/11/2025,El anï¿½ï¿½lisis de la interpretaciï¿½ï¿½n de [Actor 2] como figura t,Un ser lleno de dolor e inocencia robada.,
173,Generacion Z,Influencers promueven boicot a marcas que no se pronuncian,TikTok,15/11/2025,Piden a las empresas tomar posiciï¿½ï¿½n polï¿½,Las marcas deben tener responsabilidad social.,
174,Frankenstein,Frankenstein: Un ï¿½ï¿½xito inesperado de Netflix L,Netflix Data,14/11/2025,La pelï¿½ï¿½cula se posiciona como la mï¿½ï¿½s vista en la ,Un triunfo para el cine de autor en streaming.,
175,Generacion Z,La voz de la Generaciï¿½ï¿½n Z en los medios tradicion,Prensa Libre,18/11/2025,Los medios dan mï¿½ï¿½s espacio a las demandas de los jï¿½ï,La presiï¿½ï¿½n de la calle obliga a los medios a reaccio,
176,Frankenstein,"Del Toro sobre el final: ""Un toque de esperanza""",Entrevista Exclusiva,07/11/2025,El director defiende un cierre menos nihilista.,"Un final que te deja pensando, pero con luz.",
177,Generacion Z,Activistas denuncian detenciones arbitrarias,ONG Derechos Humanos,16/11/2025,Piden la liberaciï¿½ï¿½n inmediata de los deteni,La represiï¿½ï¿½n es el peor enemigo de la democra,
178,Frankenstein,El impacto de la pelï¿½ï¿½cula en la moda gï¿½ï¿½tic,Fashionista,10/11/2025,Las tendencias de vestuario de la pelï¿½ï¿½cula inspiran nuevos lo,El estilo victoriano estï¿½ï¿½ de vuelta gracias a Del T,
179,Generacion Z,Anï¿½ï¿½lisis de los cï¿½ï¿½nticos y consignas de l,Lingï¿½ï¿½ï¿½ï¿½stic,17/11/2025,El uso del sarcasmo y el humor negro en las protestas.,Protestar con inteligencia es el sello de la Gen Z.,
180,Frankenstein,Frankenstein en el Top 10 de IMDb,IMDb Charts,15/11/2025,La pelï¿½ï¿½cula mantiene una alta calificaciï¿½ï¿½n entre los u,Una obra maestra que perdurarï¿½,
181,Generacion Z,Usuarios de Reddit discuten la efectividad de las marchas,Reddit r/Mexico,18/11/2025,Debate sobre si el cambio se logra en la calle o en las urnas.,"La calle mueve la aguja, la urna lo consolida.",
182,Frankenstein,La crï¿½ï¿½tica elogia la cinematografï¿½ï¿½a en blanco y negro (Versiï¿½ï¿,Sundance Review,12/11/2025,Se lanzï¿½ï¿½ una ediciï¿½ï¿½n limitada en blanco y negro par,El B&N intensifica la tragedia.,
183,Generacion Z,Cobertura en vivo de la marcha es la mï¿½ï¿½s vista en Face,Facebook Live,16/11/2025,Miles de personas siguieron la transmisiï¿½ï¿½n en tiempo r,La transmisiï¿½ï¿½n en vivo es la nueva crï¿½,
184,Frankenstein,"Del Toro: ""Mi Frankenstein no tiene miedo"," tiene dolor""",MasterClass,09/11/2025,El director explica la emociï¿½ï¿½n dominante de la criat,El dolor como motor de la monstruosidad.
185,Generacion Z,La Generaciï¿½ï¿½n Z y su relaciï¿½ï¿½n con el pasado p,Revista Nexos,17/11/2025,Los jï¿½ï¿½venes critican a generaciones anteriores por la inacci,No queremos cometer los mismos errores.,
186,Frankenstein,Actriz [Actriz 3] sobre el rol femenino en la historia,Women in Film,11/11/2025,El papel de las mujeres en la nueva adaptaciï¿½ï,Los personajes femeninos son el ancla moral.,
187,Generacion Z,"Marcha es calificada como ""evento generacional""",Analistas Polï¿½ï¿½t,18/11/2025,Se compara el impacto cultural con el Vive Latino.,Un momento definitorio para la juventud mexicana.,
188,Frankenstein,Frankenstein es la pelï¿½ï¿½cula mï¿½ï¿½s tuiteada de l,Twitter Trends,08/11/2025,Millones de menciones sobre el estreno.,El poder de Del Toro en las redes.,
189,Generacion Z,Grupos de apoyo legal asisten a detenidos,Pro Bono Mï¿½ï¿½,16/11/2025,Abogados ofrecen ayuda gratuita a los arrestados.,La asistencia legal es una forma de protesta.,
190,Frankenstein,Del Toro elogia la actuaciï¿½ï¿½n de [Actor 4] como Henry Cle,Entrevista Backstage,07/11/2025,El director destaca el soporte emocional del personaje.,Clerval es la consciencia de Vï¿½ï¿½c,
191,Generacion Z,El uso de cï¿½ï¿½digos y emojis en la convocat,Wired,15/11/2025,Anï¿½ï¿½lisis de cï¿½ï¿½mo se organizan secre,La Gen Z inventa sus propios cï¿½ï¿½digos para la seguri,
192,Frankenstein,Los coleccionables de Frankenstein se agotan en lï¿½ï¿,Merchandise News,13/11/2025,Figuras y pï¿½ï¿½sters de ediciï¿½ï¿½n l,El merchandising es un ï¿½ï¿½xito rotu,
193,Generacion Z,Medios internacionales critican la respuesta del gobierno,The New York Times,17/11/2025,La reacciï¿½ï¿½n oficial es vista como minimizaci,El mundo observa el trato a los manifestantes.,
194,Frankenstein,Frankenstein: Una clase magistral de diseï¿½ï¿½o de so,Audio Post,10/11/2025,El uso del silencio y los efectos de sonido gutural.,El diseï¿½ï¿½o de sonido es perturbador y brilla,
195,Generacion Z,Testimonios de desalojo en la Alameda Central,Diario de Mï¿½ï¿½,16/11/2025,Cuentas de primera mano sobre la intervenciï¿½ï¿½n polic,La violencia no nos va a detener.,
196,Frankenstein,"Del Toro: ""Es una tragedia sobre la paternidad fallida""",Focus Features,05/11/2025,El director se enfoca en la responsabilidad del creador.,Un tema universal que Del Toro maneja con maestrï¿½ï,
197,Generacion Z,Las 'Fake News' sobre la marcha: Desmentidos de la Gen Z,VerificadorMx,15/11/2025,Jï¿½ï¿½venes usan sus redes para desmentir rumores oficia,La Gen Z lucha contra la desinformaciï¿½ï¿½n en tiempo r,
198,Frankenstein,Frankenstein se proyecta en la Cineteca Nacional,Cineteca Agenda,28/10/2025,Funciï¿½ï¿½n especial con presencia de crï¿½ï,Un evento cultural imperdible en la Cineteca.,
199,Generacion Z,Impacto en la cultura pop: Mï¿½ï¿½sicos se unen a la prot,Rolling Stone MX,17/11/2025,Bandas de rock y rap se pronuncian y donan fondos.,Los artistas son aliados del cambio.,
200,Frankenstein,La controversia del casting en redes sociales,Twitter Debate,04/11/2025,Discusiï¿½ï¿½n sobre la elecciï¿½ï¿½n de un actor 'demasiado,"Al final, la actuaciï¿½ï¿½n superï¿½ï¿½ el debate del ",
