ID,Categoria,Titulo,Medio,Fecha,Resumen,Comentario_Reaccion,
1,Generacion Z,Gen Z-styled protests spread in Mexico,Reuters,16/11/2025,Protestas tras asesinato de alcalde; enfrentamientos con policï¿½ï,"Jï¿½ï¿½venes exigen seguridad, no sï¿½ï¿½lo retï¿½ï¿½rica polï¿½ï¿½tica.",
2,Frankenstein,Frankenstein ya en streaming,Netflix Tudum,07/11/2025,La pelï¿½ï¿½cula se estrena en Netflix; estructura en tres ac,"La versiï¿½ï¿½n de Del Toro es increï¿½ï¿½blemente emotiva, ï¿½ï¿½lï¿½ï¿½grimas garantizadas! ",
3,Generacion Z,Sheinbaum desautoriza marcha de la generaciï¿½ï¿,El Paï¿½,17/11/2025,Gobierno seï¿½ï¿½ala baja participaciï¿½ï¿½n juvenil y presencia de opositores ,"Dicen que somos pocos, pero el ruido que hacemos es por todos. #SomosMas",
4,Frankenstein,Del Toro visita CDMX por estreno,Milenio,30/10/2025,Del Toro y elenco asistirï¿½ï¿½n a evento en Ciudad de Mï¿½,"Necesito ir a la alfombra roja, GDT es un ï¿½ï¿½dolo de la estï¿½ï¿½tica gï¿½ï¿",
5,Generacion Z,Gobierno vincula marcha con desinformaciï¿½,El Paï¿½,13/11/2025,Acusan campaï¿½ï¿½a digital financiada con bots e influenc,Siempre es mï¿½ï¿½s fï¿½ï¿½cil culpar a los bots que escuchar la calle. #No,
6,Frankenstein,Estreno en cines mexicanos,TV Azteca,23/10/2025,Se proyecta solo en cines seleccionados e independientes.,Una obra maestra que DEBE verse en pantalla grande. El sonido es vital.,
7,Generacion Z,Generaciï¿½ï¿½n Z toma las ca,Euronews,16/11/2025,20 detenidos y 100 policï¿½ï¿½as heridos en movilizacio,"Los enfrentamientos escalaron. Piden diï¿½ï¿½logo, no represi",
8,Frankenstein,Frankenstein llega a Netflix,El Financiero,04/11/2025,Disponible en streaming desde el 7 de noviembre.,Perfecto para un maratï¿½ï¿½n de terror melancï¿½ï¿½lico este fin de,
9,Generacion Z,Testimonios de jï¿½ï¿½venes sobre prot,El Paï¿½,16/11/2025,"Jï¿½ï¿½venes denuncian inseguridad, falta de medicinas y problemas socia",El grito es por el futuro que nos estï¿½ï¿½n robando. #MexicoDespi,
10,Frankenstein,13 minutos de aplausos en Venecia,El Financiero,31/08/2025,La pelï¿½ï¿½cula recibe ovaciï¿½ï¿½n en el Festival de ,La crï¿½ï¿½tica la ama. Del Toro lo vuelve a hacer con el gï¿½ï¿½nero de mo,
11,Generacion Z,Anï¿½ï¿½lisis: ï¿½ï¿½Quï¿½ï¿½ busca realmente la Gen Z en ,BBC Mundo,18/11/2025,Estudio indica desconfianza en instituciones y uso de memes como protesta.,"Usamos los memes para reï¿½ï¿½r, pero la indignaciï¿½ï¿½n es real. #Protest",
12,Frankenstein,Oscar a Mejor Maquillaje asegurado para GDT,Variety,15/11/2025,Expertos predicen mï¿½ï¿½ltiples nominaciones por el diseï¿½ï¿½o del M,El look del Monstruo es desgarradoramente bello. Del Toro y su estï¿½ï¿½t,
13,Generacion Z,El factor TikTok en las protestas mexicanas,DW,15/11/2025,La red social es la principal herramienta de convocatoria y difusiï¿½ï,"Vi el live de la marcha en TikTok, mucho mï¿½ï¿½s rï¿½ï¿½pido que las n",
14,Frankenstein,La nueva visiï¿½ï¿½n de la criatura de Del ,Rolling Stone,08/11/2025,El director se enfoca en la soledad y la humanidad del Monstruo.,"No es solo terror, es drama existencial. Mary Shelley estarï¿½ï¿½a orgull",
15,Generacion Z,Marcha: ï¿½ï¿½El inicio de un nuevo movimiento juve,Reforma,17/11/2025,Sociï¿½ï¿½logos debaten si las protestas tienen el potencial de la Primavera ï¿½,"Espero que sea el inicio de un cambio real, no solo un flash.",
16,Frankenstein,Elenco de lujo cautiva a la audiencia global,Hollywood Reporter,09/11/2025,Anï¿½ï¿½lisis de las actuaciones de [Actor 1] y [Actor 2] como Dr. y Monst,"[Actor 2] como el Monstruo es brutal, sin palabras.",
17,Generacion Z,Gobierno refuerza seguridad en el Zï¿½ï¿½,Milenio,14/11/2025,"Tras el intento de ocupaciï¿½ï¿½n, se duplica la presencia polic","Mucha seguridad para cuidar edificios, y poca para cuidar ciudadanos.",
18,Frankenstein,Frankenstein: ï¿½ï¿½La obra maestra mï¿½ï¿½s oscura,IndieWire,10/11/2025,Comparaciï¿½ï¿½n con El Laberinto del Fauno y La Forma del A,"Mï¿½ï¿½s oscura, mï¿½ï¿½s profunda, mï¿½ï¿½s dolorosa. Del Toro en su ",
19,Generacion Z,ýýQuiýýn financia la movilizaciýýn digital de la Gen Z?,El Universal,13/11/2025,Investigaciï¿½ï¿½n sobre el origen de los hashtags vira,Es increï¿½ï¿½ble cï¿½ï¿½mo minimizan nuestra voz llamï¿½ï¿½ndola ',
20,Frankenstein,La estï¿½ï¿½tica victoriana y el detalle de producc,Screen Rant,06/11/2025,Entrevista con la diseï¿½ï¿½adora de producciï¿½ï¿½n sobre el mundo de la pe,"Cada toma es una pintura, la direcciï¿½ï¿½n de arte es de otro mu",
21,Generacion Z,Estudiantes se suman a las demandas de la marcha,La Jornada,15/11/2025,Facultades de la UNAM y el IPN emiten comunicados de apoyo.,Es un movimiento estudiantil y social. ï¿½ï¿½Todos jun,
22,Frankenstein,Trï¿½ï¿½iler rompe rï¿½ï¿½cord de vistas en,Forbes,01/10/2025,El avance de la pelï¿½ï¿½cula se vuelve viral en ho,El trï¿½ï¿½iler me puso la piel de gallina. Del Toro sabe cï¿½ï¿½mo vender mo,
23,Generacion Z,Influencers denuncian intimidaciï¿½ï¿½n tras apoyar las prote,El Paï¿½,17/11/2025,Cuentas grandes reportan ataques coordinados y amenazas.,"Si apoyas la protesta, te atacan. Es un miedo constante.",
24,Frankenstein,"Del Toro sobre la ciencia: ""Es la ambiciï¿½ï¿½n hu""",The Guardian,07/11/2025,Cita del director sobre el verdadero horror de la historia.,La ciencia sin ï¿½ï¿½tica es el verdadero monstruo. Del Toro lo entie,
25,Generacion Z,Mï¿½ï¿½xico: La generaciï¿½ï¿½n del cambi,CNN Espaï¿½ï,18/11/2025,Reportaje especial sobre el activismo juvenil en Latam.,"Gen Z estï¿½ï¿½ harta de promesas vacï¿½ï¿½as, es hora de",
26,Frankenstein,Critica: La obra que define la filmografï¿½ï¿½a de Del ,SensaCine,05/11/2025,Una reseï¿½ï¿½a que alaba la madurez narrativa y visual del direc,"Mi pelï¿½ï¿½cula favorita de GDT, pu",
27,Generacion Z,Padres de familia expresan apoyo a la marcha de sus hijos,El Heraldo,16/11/2025,Adultos mayores se unen a las filas en solidaridad.,"No es solo la Gen Z, es una preocupaciï¿½ï¿½n nacio",
28,Frankenstein,Anï¿½ï¿½lisis: ï¿½ï¿½Por quï¿½ï¿½ Frankenstein sigue siend,Vulture,12/11/2025,La historia toca temas de rechazo social y disidencia.,"La Gen Z se identifica mucho con el Monstruo, un marginado incomprendido.",
29,Generacion Z,Hashtags de protesta se vuelven *trending* mundial,Twitter News,15/11/2025,#MexicoDespierta y #GenZPorLaPaz lideran tendencias.,La protesta digital es la nueva plaza pï¿½ï¿½bl,
30,Frankenstein,Efectos visuales minimalistas y el poder de la caracterizaciï¿½,FX Magazine,10/11/2025,El uso de maquillaje prï¿½ï¿½ctico sobre CGI es un acie,Gracias Del Toro por el maquillaje tradicional. Se siente mï¿½ï¿½s r,
31,Generacion Z,Policï¿½ï¿½a Cibernï¿½ï¿½tica investiga origen de desinfo,El Paï¿½,14/11/2025,Seï¿½ï¿½alan cuentas vinculadas a grupos de oposici,La narrativa de culpar al otro nunca cambia.,
32,Frankenstein,"Del Toro en entrevista: ""Es una carta de amor a Mary Shelley""",CinemaBlend,07/11/2025,El director discute la fidelidad al espï¿½ï¿½ritu del li,Se siente el respeto por la fuente original.,
33,Generacion Z,Anï¿½ï¿½lisis: Las demandas econï¿½ï¿½micas de la Gener,Expansiï¿½,17/11/2025,Los jï¿½ï¿½venes exigen salarios dignos y acceso a la vivie,"No podemos pagar la renta, el problema no es solo polï¿½ï¿½t",
34,Frankenstein,Los 5 momentos mï¿½ï¿½s emotivos de Frankenstein (Spoiler F,BuzzFeed,09/11/2025,Lista de escenas destacadas por su carga dramï¿½ï¿½t,El momento del espejo es devastador.,
35,Generacion Z,Mï¿½ï¿½xico D.F.: Centro de la protesta juv,Reuters,16/11/2025,Cientos se congregan en el ï¿½ï¿½ngel de la Independen,"El ï¿½ï¿½ngel es nuestro punto de reuniï¿½ï¿½n, el sï¿½ï¿½mbolo de ",
36,Frankenstein,ýýHabrýý secuela? GDT responde,Collider,14/11/2025,Del Toro dice que esta es una historia autocontenida.,"Perfecto, no necesita secuela. Es completa asï¿½",
37,Generacion Z,Uso de tecnologï¿½ï¿½a para evitar represiï¿½ï¿½n ,VICE News,15/11/2025,Apps de mensajerï¿½ï¿½a cifrada y transmisiï¿½ï¿½n en vivo para documentar,Hay que estar protegidos. Documentar es protegernos.,
38,Frankenstein,El papel del color y la luz en la pelï¿½ï¿½,FilmeNow,06/11/2025,Anï¿½ï¿½lisis visual del director de fotograf,La paleta de colores es sombrï¿½ï¿½a y herm,
39,Generacion Z,Gobierno acusa vandalismo en monumentos histï¿½ï¿½r,INAH,17/11/2025,Daï¿½ï¿½os en edificios y estatuas tras los enfrentamien,Una minorï¿½ï¿½a violenta desvï¿½ï¿½a la atenciï¿½ï¿½n de las dema,
40,Frankenstein,Estreno de Frankenstein genera debate en Reddit,Reddit r/movies,08/11/2025,Discusiï¿½ï¿½n sobre la adaptaciï¿½ï¿½n y la controversia del ,"Hay opiniones divididas, pero la mayorï¿½ï¿½a ama la direcciï¿½ï¿½n",
41,Generacion Z,Movilizaciï¿½ï¿½n: ï¿½ï¿½Una ola organizada o espo,El Paï¿½,18/11/2025,Expertos debaten la naturaleza del movimiento juvenil.,Es espontï¿½ï¿½neo pero con un sentimiento colect,
42,Frankenstein,"Actores describen el proceso de maquillaje como ""tortuoso""",The Hollywood Reporter,11/11/2025,Horas de trabajo diario para lograr la apariencia del Monstruo.,El compromiso del actor es admirable.,
43,Generacion Z,Anï¿½ï¿½lisis de lenguaje visual de la prot,Diseï¿½ï¿½,15/11/2025,Uso de carteles minimalistas y referencias a memes.,El diseï¿½ï¿½o comunica mï¿½ï¿½s que un discurs,
44,Frankenstein,La mï¿½ï¿½sica de [Compositor] eleva la emoc,Soundtrack World,05/11/2025,Reseï¿½ï¿½a de la banda sonora de la pelï¿½,"La mï¿½ï¿½sica es ï¿½ï¿½pica y melancï¿½ï¿½lic",
45,Generacion Z,Jï¿½ï¿½venes convocan a una segunda marcha en dicie,Redes Sociales,17/11/2025,La convocatoria es para el dï¿½ï¿½a 10 de diciem,No nos cansaremos hasta ser escuchados.,
46,Frankenstein,Comparativa: ï¿½ï¿½Mejor que las versiones clï¿½ï,Den of Geek,07/11/2025,El artï¿½ï¿½culo compara la nueva versiï¿½ï¿½n con las de la Un,"Es diferente, pero respeta el alma del mito.",
47,Generacion Z,Marcha: Un grito contra la corrupciï¿½ï¿½n y la impun,W Radio,16/11/2025,Las demandas centrales giran en torno a la justicia.,Queremos justicia por todos los crï¿½ï¿½menes impu,
48,Frankenstein,"Del Toro: ""El Monstruo es el niï¿½ï¿½o he""",Entrevista Televisa,04/11/2025,El director explica su enfoque psicolï¿½ï¿½gico del person,Una visiï¿½ï¿½n tierna y trï¿½ï¿½gica a,
49,Generacion Z,Testimonios: Jï¿½ï¿½venes que fueron por primera vez a mar,Aristegui Noticias,18/11/2025,Historias de la experiencia inicial en las protestas.,"Sentï¿½ï¿½ miedo, pero tambiï¿½ï¿½n mucha esperanza al ver a tantos j",
50,Frankenstein,ýýxito de taquilla limitada en cines independientes,Box Office Guru,13/11/2025,La pelï¿½ï¿½cula tuvo buenas cifras antes de pasar a stream,"Vale la pena pagar el cine, es una experiencia inmersiva.",
51,Generacion Z,Movilizaciï¿½ï¿½n en Guadalajara y Monte,El Norte,16/11/2025,Las protestas se replican en otros estados clave.,"No es solo CDMX, la inconformidad es nacional.",
52,Frankenstein,Del Toro explica el final alternativo,Revista Empire,15/11/2025,Detalles sobre las escenas eliminadas y cambios de guion.,"Interesante, pero el final que eligiï¿½ï¿½ es perfe",
53,Generacion Z,Debate en Twitter: ï¿½ï¿½Falta de liderazgo en la Ge,El Universal,17/11/2025,Algunos critican la falta de una figura central en el movimiento.,"No necesitamos lï¿½ï¿½deres, somos una red distribu",
54,Frankenstein,Anï¿½ï¿½lisis del vestuario como herramienta narra,Vogue Mï¿½ï¿½,08/11/2025,La ropa refleja el estatus y la decadencia moral.,"El vestuario es sombrï¿½ï¿½o y elegante, muy ",
55,Generacion Z,Reporte: Uso de VPN y Tor para comunicaciï¿½ï¿½n se,TechCrunch,15/11/2025,La Gen Z utiliza herramientas digitales para evadir vigilancia.,La seguridad digital es parte de la protesta.,
56,Frankenstein,Netflix compra los derechos globales por una cifra millonaria,Deadline,25/10/2025,El acuerdo garantiza una distribuciï¿½ï¿½n mas,La ï¿½ï¿½nica forma de verla es con una buena platafo,
57,Generacion Z,El lenguaje inclusivo y la Gen Z en la protesta,Cultura Colectiva,16/11/2025,Anï¿½ï¿½lisis del vocabulario utilizado en las consig,La Gen Z trae consigo una nueva forma de hablar y protestar.,
58,Frankenstein,"Del Toro sobre el CGI: ""Solo donde sea estrictamente necesario""",Video Production,06/11/2025,ýýnfasis en los efectos prýýcticos y la artesanýýa.,Se nota la mano de un maestro artesano.,
59,Generacion Z,Gobierno acusa a partidos de derecha de infiltrar la marcha,Milenio,14/11/2025,Argumentan que buscan desestabilizar la administraciï¿½ï,La vieja polï¿½ï¿½tica siempre tratando de manipular,
60,Frankenstein,Frankenstein: El monstruo que nos obliga a vernos,Psicologï¿½ï¿½a y ,11/11/2025,Anï¿½ï¿½lisis psicolï¿½ï¿½gico de la relaciï¿½ï¿½n cread,Refleja nuestras propias inseguridades y rechazos.,
61,Generacion Z,Gen Z crea su propia narrativa en YouTube,YouTube Trends,16/11/2025,Canales de jï¿½ï¿½venes documentan la marcha sin filt,La mejor cobertura estï¿½ï¿½ en los canales independien,
62,Frankenstein,La iluminaciï¿½ï¿½n como personaje en el film de Del ,Cinephilia,09/11/2025,Estudio de cï¿½ï¿½mo el claroscuro define el tono de la pelï¿½,Cada escena parece sacada de un cuadro barroco.,
63,Generacion Z,Anï¿½ï¿½lisis: Diferencias con el movimiento estudiantil de,History Channel,18/11/2025,Comparativa entre el activismo actual y el pasado.,"Diferentes ï¿½ï¿½pocas, la misma necesidad de cam",
64,Frankenstein,La visiï¿½ï¿½n del Dr. Frankenstein como un niï¿½ï¿½o ca,The New Yorker,12/11/2025,Crï¿½ï¿½tica que examina la inmadurez moral del cientï¿½,"El Dr. es el verdadero villano, un irresponsable narcisista.",
65,Generacion Z,Reporte de Derechos Humanos condena uso excesivo de la fuerza,Amnistï¿½ï¿½a Internaci,17/11/2025,Documentan agresiones a manifestantes pacï¿½ï¿½fi,El estado no respeta nuestros derechos.,
66,Frankenstein,Guillermo del Toro anuncia un libro de arte de la pelï¿½ï¿½,Dark Horse Comics,14/11/2025,El tomo contendrï¿½ï¿½ bocetos y diseï¿½ï¿½os conce,ýýComprado! Necesito ver el proceso creativo de GDT.,
67,Generacion Z,Economistas advierten sobre el impacto de la inestabilidad social,Financial Times,18/11/2025,Las protestas pueden afectar la inversiï¿½ï¿½n extranj,La inestabilidad la crea el gobierno que no escucha.,
68,Frankenstein,Frankenstein y el cine gï¿½ï¿½tico: Un regreso a las raï,Horror Freak,05/11/2025,La pelï¿½ï¿½cula abraza la tradiciï¿½ï¿½n del horror c,Un homenaje perfecto a los monstruos de antaï¿½ï,
69,Generacion Z,Manifestantes utilizan drones para documentar la marcha,Tecnologï¿½ï¿½a para el Ca,16/11/2025,Cï¿½ï¿½maras aï¿½ï¿½reas registran la magnitud de la concent,Los drones muestran la verdad que los medios no quieren ver.,
70,Frankenstein,"Del Toro agradece el recibimiento: ""Una obra personal""",Discurso de Premiere,30/10/2025,El director se emociona al hablar de su conexiï¿½ï¿½n con la histo,Se siente la pasiï¿½ï¿½n en cada fotogr,
71,Generacion Z,Comentarios: La marcha dividiï¿½ï¿½ a las fami,Foros de Debate,17/11/2025,Generaciones mayores critican la falta de respeto a la autoridad.,Mis papï¿½ï¿½s no entienden por quï¿½ï¿½ salgo a l,
72,Frankenstein,El Monstruo de Del Toro: ï¿½ï¿½El mï¿½ï¿½s vulnerable d,Film Comment,10/11/2025,El anï¿½ï¿½lisis de la interpretaciï¿½ï¿½n de [Actor 2] como figura t,Su vulnerabilidad es lo que lo hace tan humano.,
73,Generacion Z,Influencers promueven boicot a marcas que no se pronuncian,TikTok,15/11/2025,Piden a las empresas tomar posiciï¿½ï¿½n polï¿½,"Si las marcas no nos apoyan, no las consumimos.",
74,Frankenstein,Frankenstein: Un ï¿½ï¿½xito inesperado de Netflix L,Netflix Data,14/11/2025,La pelï¿½ï¿½cula se posiciona como la mï¿½ï¿½s vista en la ,ýýQuýý orgullo para un director mexicano!,
75,Generacion Z,La voz de la Generaciï¿½ï¿½n Z en los medios tradicion,Prensa Libre,18/11/2025,Los medios dan mï¿½ï¿½s espacio a las demandas de los jï¿½ï,Es bueno que por fin nos escuchen en la radio.,
76,Frankenstein,"Del Toro sobre el final: ""Un toque de esperanza""",Entrevista Exclusiva,07/11/2025,El director defiende un cierre menos nihilista.,Un final con esa pequeï¿½ï¿½a luz es muy Del T,
77,Generacion Z,Activistas denuncian detenciones arbitrarias,ONG Derechos Humanos,16/11/2025,Piden la liberaciï¿½ï¿½n inmediata de los deteni,La represiï¿½ï¿½n es la respuesta del mi,
78,Frankenstein,El impacto de la pelï¿½ï¿½cula en la moda gï¿½ï¿½tic,Fashionista,10/11/2025,Las tendencias de vestuario de la pelï¿½ï¿½cula inspiran nuevos lo,"Me copio el look de Victor, muy elegante y oscuro.",
79,Generacion Z,Anï¿½ï¿½lisis de los cï¿½ï¿½nticos y consignas de l,Lingï¿½ï¿½ï¿½ï¿½stic,17/11/2025,El uso del sarcasmo y el humor negro en las protestas.,La mejor forma de protestar es con inteligencia y humor.,
80,Frankenstein,Frankenstein en el Top 10 de IMDb,IMDb Charts,15/11/2025,La pelï¿½ï¿½cula mantiene una alta calificaciï¿½ï¿½n entre los u,Una joya que serï¿½ï¿½ un clï¿½ï¿½sico insta,
81,Generacion Z,Usuarios de Reddit discuten la efectividad de las marchas,Reddit r/Mexico,18/11/2025,Debate sobre si el cambio se logra en la calle o en las urnas.,"Ambos. La calle presiona, la urna decide.",
82,Frankenstein,La crï¿½ï¿½tica elogia la cinematografï¿½ï¿½a en blanco y negro (Versiï¿½ï¿,Sundance Review,12/11/2025,Se lanzï¿½ï¿½ una ediciï¿½ï¿½n limitada en blanco y negro par,El B&N le da un aire mï¿½ï¿½s clï¿½ï¿½sico y dra,
83,Generacion Z,Cobertura en vivo de la marcha es la mï¿½ï¿½s vista en Face,Facebook Live,16/11/2025,Miles de personas siguieron la transmisiï¿½ï¿½n en tiempo r,"Vi todo desde casa, me sentï¿½ï¿½ parte de e",
84,Frankenstein,"Del Toro: ""Mi Frankenstein no tiene miedo"," tiene dolor""",MasterClass,09/11/2025,El director explica la emociï¿½ï¿½n dominante de la criat,"Una frase que lo resume todo, puro dolor."
85,Generacion Z,La Generaciï¿½ï¿½n Z y su relaciï¿½ï¿½n con el pasado p,Revista Nexos,17/11/2025,Los jï¿½ï¿½venes critican a generaciones anteriores por la inacci,"Heredamos un paï¿½ï¿½s roto, nos toca arregla",
86,Frankenstein,Actriz [Actriz 3] sobre el rol femenino en la historia,Women in Film,11/11/2025,El papel de las mujeres en la nueva adaptaciï¿½ï,Los personajes femeninos son mï¿½ï¿½s fuertes y comple,
87,Generacion Z,"Marcha es calificada como ""evento generacional""",Analistas Polï¿½ï¿½t,18/11/2025,Se compara el impacto cultural con el Vive Latino.,Un evento que marcarï¿½ï¿½ a esta generaci,
88,Frankenstein,Frankenstein es la pelï¿½ï¿½cula mï¿½ï¿½s tuiteada de l,Twitter Trends,08/11/2025,Millones de menciones sobre el estreno.,"El hype es real, todos estï¿½ï¿½n hablando de e",
89,Generacion Z,Grupos de apoyo legal asisten a detenidos,Pro Bono Mï¿½ï¿½,16/11/2025,Abogados ofrecen ayuda gratuita a los arrestados.,La solidaridad legal es clave en las protestas.,
90,Frankenstein,Del Toro elogia la actuaciï¿½ï¿½n de [Actor 4] como Henry Cle,Entrevista Backstage,07/11/2025,El director destaca el soporte emocional del personaje.,Clerval es la ï¿½ï¿½nica luz en la oscuridad del Dr. Frankenst,
91,Generacion Z,El uso de cï¿½ï¿½digos y emojis en la convocat,Wired,15/11/2025,Anï¿½ï¿½lisis de cï¿½ï¿½mo se organizan secre,Usamos cï¿½ï¿½digos para evitar la cens,
92,Frankenstein,Los coleccionables de Frankenstein se agotan en lï¿½ï¿,Merchandise News,13/11/2025,Figuras y pï¿½ï¿½sters de ediciï¿½ï¿½n l,Quiero el Funko Pop del Monstruo inmediatamente.,
93,Generacion Z,Medios internacionales critican la respuesta del gobierno,The New York Times,17/11/2025,La reacciï¿½ï¿½n oficial es vista como minimizaci,El mundo estï¿½ï¿½ viendo cï¿½ï¿½mo nos,
94,Frankenstein,Frankenstein: Una clase magistral de diseï¿½ï¿½o de so,Audio Post,10/11/2025,El uso del silencio y los efectos de sonido gutural.,El sonido del latido del Monstruo es aterrador.,
95,Generacion Z,Testimonios de desalojo en la Alameda Central,Diario de Mï¿½ï¿½,16/11/2025,Cuentas de primera mano sobre la intervenciï¿½ï¿½n polic,Fue violento y desproporcionado.,
96,Frankenstein,"Del Toro: ""Es una tragedia sobre la paternidad fallida""",Focus Features,05/11/2025,El director se enfoca en la responsabilidad del creador.,Es la peor historia de un papï¿½ï¿½ que abandona a su h,
97,Generacion Z,Las 'Fake News' sobre la marcha: Desmentidos de la Gen Z,VerificadorMx,15/11/2025,Jï¿½ï¿½venes usan sus redes para desmentir rumores oficia,Nos toca a nosotros ser los verificadores.,
98,Frankenstein,Frankenstein se proyecta en la Cineteca Nacional,Cineteca Agenda,28/10/2025,Funciï¿½ï¿½n especial con presencia de crï¿½ï,Verla en la Cineteca es un ritual.,
99,Generacion Z,Impacto en la cultura pop: Mï¿½ï¿½sicos se unen a la prot,Rolling Stone MX,17/11/2025,Bandas de rock y rap se pronuncian y donan fondos.,La mï¿½ï¿½sica siempre ha estado con el movimie,
100,Frankenstein,La controversia del casting en redes sociales,Twitter Debate,04/11/2025,Discusiï¿½ï¿½n sobre la elecciï¿½ï¿½n de un actor 'demasiado,"El maquillaje lo arregla, pero la esencia es Del Toro.",
101,Generacion Z,Gen Z-styled protests spread in Mexico,Reuters,16/11/2025,Protestas tras asesinato de alcalde; enfrentamientos con policï¿½ï,El hartazgo juvenil es evidente en cada pancarta.,
102,Frankenstein,Frankenstein ya en streaming,Netflix Tudum,07/11/2025,La pelï¿½ï¿½cula se estrena en Netflix; estructura en tres ac,"La mejor adaptaciï¿½ï¿½n del clï¿½ï¿½sico en dï¿½ï¿½cadas, ï",
103,Generacion Z,Sheinbaum desautoriza marcha de la generaciï¿½ï¿,El Paï¿½,17/11/2025,Gobierno seï¿½ï¿½ala baja participaciï¿½ï¿½n juvenil y presencia de opositores ,"No importa cuï¿½ï¿½ntos ï¿½ï¿½ramos, sino el mensaje qu",
104,Frankenstein,Del Toro visita CDMX por estreno,Milenio,30/10/2025,Del Toro y elenco asistirï¿½ï¿½n a evento en Ciudad de Mï¿½,Mï¿½ï¿½xico celebra a su genio del cine. ï¿½ï¿½Un ,
105,Generacion Z,Gobierno vincula marcha con desinformaciï¿½,El Paï¿½,13/11/2025,Acusan campaï¿½ï¿½a digital financiada con bots e influenc,"Si el gobierno lo niega, es porque es verdad lo que decimos.",
106,Frankenstein,Estreno en cines mexicanos,TV Azteca,23/10/2025,Se proyecta solo en cines seleccionados e independientes.,Una experiencia cinematogrï¿½ï¿½fica que vale cada p,
107,Generacion Z,Generaciï¿½ï¿½n Z toma las ca,Euronews,16/11/2025,20 detenidos y 100 policï¿½ï¿½as heridos en movilizacio,La tensiï¿½ï¿½n en las calles es insosteni,
108,Frankenstein,Frankenstein llega a Netflix,El Financiero,04/11/2025,Disponible en streaming desde el 7 de noviembre.,Lista para verla 3 veces seguidas. ï¿½ï¿½Quï¿½ï,
109,Generacion Z,Testimonios de jï¿½ï¿½venes sobre prot,El Paï¿½,16/11/2025,"Jï¿½ï¿½venes denuncian inseguridad, falta de medicinas y problemas socia","La protesta es multifactorial, no es solo un tema.",
110,Frankenstein,13 minutos de aplausos en Venecia,El Financiero,31/08/2025,La pelï¿½ï¿½cula recibe ovaciï¿½ï¿½n en el Festival de ,Merecidos aplausos para el maestro Del Toro.,
111,Generacion Z,Anï¿½ï¿½lisis: ï¿½ï¿½Quï¿½ï¿½ busca realmente la Gen Z en ,BBC Mundo,18/11/2025,Estudio indica desconfianza en instituciones y uso de memes como protesta.,El meme es la herramienta de la sï¿½ï¿½tira polï¿½ï¿½tica ,
112,Frankenstein,Oscar a Mejor Maquillaje asegurado para GDT,Variety,15/11/2025,Expertos predicen mï¿½ï¿½ltiples nominaciones por el diseï¿½ï¿½o del M,El maquillaje te cuenta toda la historia del sufrimiento del Monstruo.,
113,Generacion Z,El factor TikTok en las protestas mexicanas,DW,15/11/2025,La red social es la principal herramienta de convocatoria y difusiï¿½ï,El algoritmo nos uniï¿½ï¿½ por la ca,
114,Frankenstein,La nueva visiï¿½ï¿½n de la criatura de Del ,Rolling Stone,08/11/2025,El director se enfoca en la soledad y la humanidad del Monstruo.,Es mï¿½ï¿½s sobre la vï¿½ï¿½ctima que sobre el ,
115,Generacion Z,Marcha: ï¿½ï¿½El inicio de un nuevo movimiento juve,Reforma,17/11/2025,Sociï¿½ï¿½logos debaten si las protestas tienen el potencial de la Primavera ï¿½,Los cambios generacionales empiezan con una chispa asï¿½,
116,Frankenstein,Elenco de lujo cautiva a la audiencia global,Hollywood Reporter,09/11/2025,Anï¿½ï¿½lisis de las actuaciones de [Actor 1] y [Actor 2] como Dr. y Monst,[Actor 1] logra una frialdad increï¿½ï¿½ble como Dr. Frankenst,
117,Generacion Z,Gobierno refuerza seguridad en el Zï¿½ï¿½,Milenio,14/11/2025,"Tras el intento de ocupaciï¿½ï¿½n, se duplica la presencia polic",Blindan el poder en lugar de abrir el diï¿½ï¿½l,
